,username,userid,time,id,text,davidson,waseem,fountana
174,Alaska-Texas-Rican,@EMatosSA_PR,1541861133.0,1061168803218948096,California is putting restrictions on the clearing of brush that add fuel to the fire  ,0.673183009250769,0.08394427598864815,0.024906108
184,James Amaz,@KaptainCnowledg,1541861359.0,1061168803218948096,I doubt that the state can tell the Feds what to do with land that the Feds control.  ,0.7722466895457449,0.16457877076561114,0.04946898
63,Deborah Edwards-Oñoro,@redcrew,1541861476.0,1061168803218948096,"Replying to @realDonaldTrump Lesson for  you. Listen carefully: 
1. People lost their lives, their homes. A leader would show compassion & empathy for people in any comment about fires. 
2. Federal government owns majority of the forestland in California.
3. You cut the federal budget for forest management.  ",0.1895655333389603,0.5576200089712121,0.031464607
54,melistening2it,@melistening2it,1541862053.0,1061168803218948096,Replying to @realDonaldTrump People please understand- this man is declaring war on the citizens and media who are opposed to him. He will say anything to troll us into a civil war. He is now a cornered animal- he would rather burn the house down than go down for his wrong-doings  ,0.4186725282019692,0.6061034363571519,0.41067950000000003
176,Tracy Lou,@TracyLou3,1541862297.0,1061168803218948096,Speaking of avoidable fire deaths...  ,0.6943920266156084,0.10552948662532148,0.011978575
180,CINDI ABBOTT,@cindi_abbott,1541862638.0,1061168803218948096,"Hon, it is really not even political for me...i simply do not like rude, crude, narcissistic, divisive people like trump. It worries me that he has ANY followers!! He talks to people like they r DOGS..he embarrasses USA abroad and children talk about how mean he is. Role model NO  ",0.920283967289406,0.6535475398353747,0.06873589999999999
177,Life_in_Limousin_and_beyond,@Brixham_Me_,1541862641.0,1061168803218948096,"Replying to @realDonaldTrump I’m sitting here in England, far removed from the reality of having to live under the shadow of @realDonaldTrump Nothing he says should surprise or shock anymore but this lack of care, empathy & compassion is disgusting! Sending love to all affected by the #CaliforniaWildfires  ",0.004410181645090232,0.4134895534879899,0.096060924
64,Philly’s Just Elizabeth,@Eiggam5955,1541862713.0,1061168803218948096,Replying to @realDonaldTrump   ,0.17570862623433728,0.03352323163434365,0.013172911499999999
11,Grab ‘em by the GA Runoffs ,@jolenta,1541863916.0,1061168803218948096,"Replying to @realDonaldTrump You are a total ignoramus. Even the most clueless ppl are aware that the increased frequency of wildfires is related to climate change. You’re the god damn president, tho a wholly illegitimate one at that. Stop embarrassing us & pick up a book or get your cabinet to brief you!   ",0.26158118038232797,0.5314058541343496,0.05864627
188,Alvis A.,@topdogalvis,1541864296.0,1061168803218948096,Replying to @realDonaldTrump Thank God your position is temporary.  ,0.09207241931017084,0.2268018698384997,0.028373959
189,Rob Stimets,@RobStimets,1541864896.0,1061168803218948096,Right now it feels eternal. GIF ,0.2413580082862981,0.04932971073898933,0.030444772999999998
187,Colleen Stewart,@cstewart37,1541865293.0,1061168803218948096,This is how it’s done. Someone show Donny this pic.  ,0.10391233095974876,0.034358120211287084,0.17716310000000002
49,Benatar and Giraldo,@benatargiraldo,1541865770.0,1061168803218948096,Replying to @realDonaldTrump You suck!  ,0.7386185926428744,0.09857343930315936,0.78459054
200,steph,@stephdontcare33,1541865864.0,1061168803218948096,"obama was a worse (ECONOMICALLY) president, i'd rather have a douchebag thats at least attempting to fix issues with the Economy, then someone who ruined the U.S economically, although Obama was definitely the better gentleman, no one is here to argue that.  ",0.023082477142573447,0.36089284490200335,0.10627235
198,John Lurie,@lurie_john,1541866967.0,1061168803218948096,"Replying to @realDonaldTrump If Northern California had received anywhere near the typical amount of autumn rain this year, 4-5 inches, the fires would not be happening. 
This is a result of Climate Change.
Sorry to mention rain, I know you are afraid of it.  ",0.09350187524652556,0.5017622119232501,0.013927064
183,Kat,@Kmakinney,1541867028.0,1061168803218948096,"Brixham_Me_ You are also far removed from the reality of the reality.  This in a year ago from the CA Fire Chief.  Yes, Virginia, California is mismanaged. Cal Fire Chief Blames Wildfires on Mismanaged ForestsDespite near-record rainfall in California this past winter, the state has already seen more – and larger – fires so far in 2017, and the director of the state’s firefighting agency blames climate …courthousenews.com ",0.010212398052039549,0.5103470742311873,0.0518668
190,Life_in_Limousin_and_beyond,@Brixham_Me_,1541867449.0,1061168803218948096,I wasn’t referring to the accuracy or inaccuracy of the statement rather the sentiment with which it was relayed. To be blaming & so vitriolic about a disaster which is still ongoing in which people have lost their lives  is as low as any human being could get!  ,0.11704198548798064,0.34564292908467703,0.23156135
191,Kat,@Kmakinney,1541867817.0,1061168803218948096,"Well, I live in California, Brixy, and I'm tired of how this happens all the time.  If it's Global Warming, why not in other states?  The incompetence makes me angry.  I love the fact the POTUS wants to solve the problem, not enable more insanity.  ",0.2814275185919699,0.2487140737957205,0.20889735
61,Alex Selland,@GamerToothpick,1541869004.0,1061168803218948096,"Replying to @realDonaldTrump Can’t count how many times I’ve driven by a forest out here filled with dead wood and trees. Internet at a camp that got fined for not cleaning that stuff up, local gov won’t clean theirs cus it “hurts wildlife”....so now we burn I guess.  ",0.19014683116768605,0.5522586834605072,0.35828552
199,NetAdvisor.org®,@NetAdvisor,1541869676.0,1061168803218948096,"Replying to @realDonaldTrump Trump is correct here.
- #California Gov Continues to Fail to Control Brush Overgrowth; 
- Creates Fuel For Major #WildFires;
- Kills Trees, Contributes to #GlobalWarming too, Says Liberal Press, Mother Jones
https://motherjones.com/environment/2017/12/a-century-of-fire-suppression-is-why-california-is-in-flames/…
#CaliforniaFires #Malibu A century of fire suppression is why California is in flames""The wake-up call has already happened.""motherjones.com ",0.8635180984604707,0.5985220249302119,0.15110016
201,Visual Culture Caffe,@caffeneko,1541869929.0,1061168803218948096,CA only owns 3% of CA forest - 60% is federally owned and federally managed...and Trump cut their budget.  ,0.2796647672090581,0.27035341575485705,0.030275404
12,Phillip Kelly,@PhillipCreates,1541870541.0,1061168803218948096,"Replying to @realDonaldTrump 1. No forests anywhere near fires 
2. You cut funding to California forests because 98% of them are federal
3. You also withheld funding to North Carolina after the recent hurricaine
4. You're a piece of shit who only uses disasters to amplify rhetoric

Fuck you  ",0.9999241744475266,0.41292953855861003,0.6950569000000001
209,California Luv   QUIT ELECTING REPUBLICANS!!!,@cooldog95228,1541871234.0,1061168803218948096,  ,1.7657473994997902e-130,0.01813247552960133,0.010068049
205,Scott Woodbury,@woodburypdx,1541872539.0,1061168803218948096,"Replying to @realDonaldTrump This tweet is wrong on so many levels. 1) The Woolsey fire is not a forest fire, so forest management had little to no impact, 2) most of the Forest in California is Federal Land which means it’s managed by your administration.  ",0.27217613752440184,0.41457648586556617,0.015392302
207,Just Pete,@FredWillardTho,1541873329.0,1061168803218948096,Replying to @realDonaldTrump  The following media includes potentially sensitive content. Change settingsView ,0.04129118180020138,0.10839176450176448,0.016887952
206,Justin Onymus,@justinonymus,1541874134.0,1061168803218948096,Using facts to fight this scourge is useless. Every lie is intentional brainwashing of his supporters to strengthen the illusion he's created for them and fuel their rage and fanaticism  ,0.2668354682438385,0.30213271789833,0.1453354
62,Gerald Coalter,@jcoalter2003,1541875237.0,1061168803218948096,Replying to @realDonaldTrump Mr. Trump I have to agree.  I have always had my suspicions about these fires.  They happen with uncanny frequency.  You could almost set your watch by them and forcast when the next fire will start. I think a proper investigation is in order.  ,0.3081022418894941,0.5111241464351269,0.011526948
56,Teresa Walker,@twalker51379,1541878548.0,1061168803218948096,"Replying to @realDonaldTrump Forest management is poor you say, but gun laws are not....#Smh  ",0.09818859511170668,0.6179842129760044,0.025195811000000002
50,Look Into the Eyes of the Wolf ,@mtnsuz8,1541880042.0,1061168803218948096,"Replying to @realDonaldTrump Don't worry Californians, the Governor and the Dems will watch out for you, and the House will send needed funds. Our bully of a fake president who has no soul, heart or conscience can't be bothered because CA doesn't bow down to him and kiss his ring.....and we never will!!  ",0.1621350082896102,0.6253812350700321,0.056033112
452,carole berry,@cberry297,1541881498.0,1061168803218948096,"Replying to @realDonaldTrump A true leader would not criticize at a time when people are devastated, and hurt beyond words. A true leader would be uplifting in his words to the people. I pray God brings us a true leader in the next election.  ",0.2227246134774167,0.3387668557722621,0.014853723999999999
59,EllieFrank,@ellenoakes10,1541882496.0,1061168803218948096,"Replying to @realDonaldTrump Most of the fires began on federal lands so it’s your gross mismanagement, dude #trumptheincompetent  ",0.07016117649418747,0.2679067140470643,0.28389844
211,Truth B. Told,@TruthBT32332627,1541884208.0,1061168803218948096,Replying to @realDonaldTrump The California fires are real. We pay more federal taxes than any other state. To threaten emergency funding  for any reason is appalling and sickening. We exist. This loss of life is devastating.  ,0.6899651773083467,0.2835409692175337,0.11267239999999999
453,Richard Clark,@tallboy1951,1541884396.0,1061168803218948096,"Y’all don’t have a governor, if you did, the millions y’all spend to clean the crap off the sidewalks & streets and the billions y’all spend on illegal aliens, y’all would have money for the forest service. Y’all would have water for the farmers too.  ",0.21174058370713772,0.3722289422745153,0.46051377
13,Beth Heyd,@beth_heyd,1541884480.0,1061168803218948096,"Replying to @realDonaldTrump I am so ashamed that you’re my president my husband’s fighting this fire, has been a wild land firefighter for 28 yrs. these are true heroes. Educate yourself President on how fires start & what it takes to put them out #Woolseyfires #CaliforniaFire #firefighters #NotMyPresident  ",0.04223878170271245,0.5398317948720653,0.030635547000000003
213,The Wave Wrestler,@AaronBassist,1541885073.0,1061168803218948096,Replying to @realDonaldTrump Who do I blame again for the high pressure zone and lack of rain?  ,0.6478850555322566,0.2618942235369277,0.015853317
212,casey,@patseycline,1541885736.0,1061168803218948096,Maybe it’s time for us to live in NY and CA and form our own union!  ,0.2271866670938241,0.06449090113670726,0.043131586
224,Barry Schweigert,@OR_E_GunBigBear,1541886060.0,1061168803218948096,Oh please do it. NY and CA in separate country sounds just fine. When are you leaving?  ,0.027155185452512668,0.2432735351798835,0.031175649
225,Francisco “Pancho” Villa,@M3xTwit3RMast3R,1541886677.0,1061168803218948096,We’ll Leave When You Leave. So When Are You Returning To Europe?!!  ,0.041076017537065766,0.2121725375047448,0.33586055
51,Patti79,@Patti5179,1541886837.0,1061168803218948096,"Replying to @realDonaldTrump We welcome President Trump in California.  You are the best President the United States has ever had.  California needs a lot of help as we are overtaxed, utilities are very high, crime is out of hand, homelessness is rampant and Hepatitis A is spreading.  We need your help.  ",0.015129332310785915,0.5985424344156229,0.018867008
14,Kevin Conroy,@RealKevinConroy,1541887526.0,1061168803218948096,"Replying to @realDonaldTrump Seriously? What an ass. I’ve lived in the  Hollywood Hills. I’ve seen how seriously the homeowners clear their own land every fire season. I’ve hauled debris away myself. Firemen fine you if you don’t, then clear it themselves. When have YOU  broken a sweat hauling debris? Ass  ",0.9941633965218823,0.5157918408801161,0.44283995
226,casey,@patseycline,1541888923.0,1061168803218948096,"Open up your eyes!!  Trump is not only ripping off the American taxpayers, he’s destroying our country our reputation at the same time. “There are none so blind as those that will not see.”  ",0.22174544390532944,0.4809677794999545,0.2960099
217,Jennie G,@Jenjenmm21,1541890966.0,1061168803218948096,"Replying to @realDonaldTrump I'm a suportr. But I take great exception w/ur tweet. I live 15 m. from TO shooting. Hours later fires start.Fires in cities&brush, not lack of tree clearance. W/both..firefighters/police/citizens giving everything, incl. their lives.Our hearts r bleeding here.U owe us an apology  ",0.026853059823847537,0.4884644098399793,0.04682795
219,Ron Babuka,@RonBabuka,1541891446.0,1061168803218948096,Replying to @realDonaldTrump 57% of the forest in CA are owned by the Federal government.  ,0.0630112999480485,0.2411442703463684,0.03418513
451,Linda Kazmir Pomeroy ,@MusicalMickey,1541892798.0,1061168803218948096,"Often the truth is unkind. The President mentioned the mismanagement problem after the last Cali fire disaster. Did Californians do anything to improve the situation? Obviously not! Some of our friends lost everything. Hate the fires, not the President  ",0.3354905541609853,0.3907376328363703,0.173413
220,jm,@MastinJaime,1541893311.0,1061168803218948096,"California alone has world's 5th largest economy. Should consider buying the forests back. Or maybe try not being the state with most homeless. I read California only pays for 2% of it's forests, that's between state and private ownership in 2017.  ",0.4425410483719993,0.3777572744282373,0.033618428
221,eljonsmith,@eljonsmith,1541894298.0,1061168803218948096,"Replying to @realDonaldTrump I highly doubt The President will see this..  but just in case! Sir, I respect the office, but as a firefighter I find this to be incredibly poor taste.  This is our country, and you’re not helping.  Respect to my brothers and sisters on the line!  ",0.01935276449466522,0.3307087167169168,0.027301235
218,Make America Kind Again,@makeusakind2020,1541894508.0,1061168803218948096,How are you supporting someone who has caused the very pain you feel by this tweet to multiple others who have been directly affected by his vileness? My heart goes to you all this week. God bless.  ,0.003805869663724261,0.28210967343267024,0.015165143999999998
462,Marc 10er,@Marc10er,1541894685.0,1061168803218948096,60% of all CA wild lands are federally owned and maintained. Only 3% are owned by state. Roughly 90% of what is burning is federal land. All 3 of the big fires currently began on federal park or forest land. CA park services CAN NOT clear federal land. The end.  ,0.3200407255493677,0.4189998171070138,0.012959518
40,BմԵԵҽɾƒӀվՀօѵҽ#TeamPelosi #GӀօѵҽՏOƒƒ,@ButterflyLove_8,1541894795.0,1061168803218948096,Replying to @realDonaldTrump BOOM!!  ,0.18164677702416668,0.042719633398680665,0.016737457
15,Carlo Crow Fiorletta,@carlofiorletta,1541894798.0,1061168803218948096,Replying to @realDonaldTrump Tough words from the #TaxScam #FakePresident who tweets from hotel room rather than brave rain to attend a veteran-honoring service. Someday we'll have a real president again like @POTUS44  ,0.3951288300218408,0.3667433871034487,0.010982622
239,Meredith Kercher remembered,@MKRemembered,1541894829.0,1061168803218948096,Not accurate.  ,0.3001133138363611,0.030948393586904495,0.10274342
222,Ivispark,@Spark121480,1541895220.0,1061168803218948096," Quote TweetPasadena Fire Assn.@PFA809 · Nov 10, 2018Mr. President, with all due respect, you are wrong.  The fires in So. Cal are urban interface fires and have NOTHING to do with forest management.  Come to SoCal and learn the facts & help the victims.  Scott Austin, Pres IAFF 809. @IAFFNewsDesk twitter.com/realDonaldTrum… ",0.005597520387896137,0.5369586480897438,0.043498587000000005
232,Deepwater,@RandyHarris43,1541896107.0,1061168803218948096,For the most part he is spot on ! Cali doesn’t do control burn that would keep most fires from getting so big !  ,0.1399276531424226,0.30427124083145585,0.0850937
16,CaptainBluntschliThe_Patriachy_Apostle,@PraiseBlossom1,1541898204.0,1061168803218948096,"Replying to @realDonaldTrump I'm a Nigerian and even though our leaders can be heartless sometimes, they won't tweet something like this after a disaster  ",0.472863803990277,0.19114073545090174,0.05466887
243,DianeLenning-JD/EdM,@LdyDianeLenning,1541898309.0,1061168803218948096,President Trump is talking about “Forest Fires.” You’re misinterpreting what he said  ,0.3255496896662013,0.1110814959701155,0.1409451
244,ItsaPhillyJawn,@OneUnifiedProj,1541898397.0,1061168803218948096,"Uh, no. No he is not.  ",0.2355962538827616,0.2027216314043017,0.5416091
245,DianeLenning-JD/EdM,@LdyDianeLenning,1541899089.0,1061168803218948096,President Trump said forest fires. We don’t have forest fires in So CA. Forest fires are in Northern CA and some in Malibu area which is not So CA.  ,0.15215994600008198,0.29575258881941763,0.022385062999999997
246,Natalie| loves Chyler Leigh ミ☆,@earth3lexiegrey,1541899172.0,1061168803218948096,Forest fires are forest fires no matter where they are so the information is the same no matter what.  ,0.059498254500100274,0.2032979290067,0.014855084
247,DianeLenning-JD/EdM,@LdyDianeLenning,1541899470.0,1061168803218948096,Forest Management is different than Firefighters who fight the fires. Fire fighters’ gov’t entities in CA give directions to forest management to leave tinder & dead wood due to environmentalists lawsuits. We love our fire fighters! I’ve followed our CA problem 4 40 years here.  ,0.1420784180819891,0.4021913446847965,0.012847482
233,Jules- Biden My Time Until Sanity! ,@julesdontplay,1541899851.0,1061168803218948096,Says a man in Louisiana.  ,0.2716589972482965,0.2312631556810181,0.19911756
248,Nate Piraccini,@Nater_Tater913,1541899934.0,1061168803218948096,"Regardless whether what he is saying is true or not. It’s doesn’t matter right now. The point is people are dying, and now is certainly not the time. Save the people the homes the animals and everything first. Have some compassion. Then we can’t have this conversation  ",0.013873997338281702,0.5548505892736562,0.23185705
454,Nicole Elin,@innocentcrush,1541900057.0,1061168803218948096,"Replying to @realDonaldTrump if u can interpret or read this map, u would notice lil something called the #SantaAnaWinds which are strong down slope winds that blow through the mountain passes in Southern CA. These winds can easily exceed 40 mph are warm, dry and can severely exacerbate brush or forest fires  ",5.890019183291007e-05,0.5252505978141471,0.016563917
223,Mike,@MJam2303,1541900398.0,1061168803218948096,Replying to @realDonaldTrump   ,0.17570862623433728,0.03352323163434365,0.013172911499999999
235,Kersti Malvre,@kersti_malvre,1541902913.0,1061168803218948096,Replying to @realDonaldTrump Tell that to my 80 year old Aunt whose house burned down to the ground in Paradise!! She and her 85 year old husband drove for hours through burning country side not knowingly they would survive. You are a MONSTER!!  ,0.003504721876816632,0.570855118088543,0.81431097
231,Kersti Malvre,@kersti_malvre,1541903397.0,1061168803218948096,"Thank you Ted for the facts! I am so upset. My 80 year old Auntie and her 85 yr old husband lost their house in Paradise. That is their retirement, filled with memories of a long lived life. They got  out with only their lives and drove thru FIRE-HELL! Trump is a MONSTER!!  ",0.0017679814959652015,0.5388122514731402,0.22002633
250,Margarita Lamar,@Margo_Lamar,1541905029.0,1061168803218948096,"Yea, he made the fire,  ",0.8639575925957771,0.05642031297055576,0.054441974000000004
237,Ramona Moreland,@sewcrazeee,1541905152.0,1061168803218948096,Replying to @realDonaldTrump   ,0.17570862623433728,0.03352323163434365,0.013172911499999999
241,CryptoHound,@CreateCrypto,1541907058.0,1061168803218948096,"Replying to @realDonaldTrump Pathological liar. You cut the funds to manage these Federal lands in California. This is on you. How very presidential of you to point fingers in the wrong direction during a crisis, when it’s your fault in the first place.  ",0.04209830345804074,0.6052014157486598,0.23988281
242,Shelly  Biden/Harris Victory! ,@Micmp1P,1541907952.0,1061168803218948096,"As my dad used to say ""When you point your finger at someone, there are 3 pointing right back at you"".  ",0.7173514438177584,0.18216833183424944,0.03354328
251,Kersti Malvre,@kersti_malvre,1541909951.0,1061168803218948096,No way!! My problem with Trump is “Blame the Victim”. How would you feel if Trump blamed your grandparents for fire or hurricane that destroyed everything and said he would not help? We are ALL AMERICANS!!! Let’s come together!!!  ,0.7513486980767586,0.4076735610473747,0.08508148
236,ᴋᴀᴛᴇ - ғᴏʀ ᴛʜᴇ ᴀʟʟɪᴀɴᴄᴇ,@frostmourned,1541911020.0,1061168803218948096,I hope they managed to get out okay.  ,0.2116736116915571,0.08394808114466808,0.044803273
255,Kersti Malvre,@kersti_malvre,1541911378.0,1061168803218948096,"Yes. They are safe with their daughter in Berkeley. Shattered, in shock, but safe. Thank you for asking. You are so kind. You can’t believe the number of haters. I am astonished and so sad.  ",0.003674603699506265,0.3468182292548127,0.030615374
266,Pushcart Peddler,@DivinaFarms,1541911404.0,1061168803218948096,Make that about 1 million.  ,0.4242322740818099,0.13340750158731493,0.039205264
272,Thomas Hussak,@ThomasHussak,1541912099.0,1061168803218948096, for sure  ,0.317341657040779,0.0109106395709476,0.07741375
227,Barry Schweigert,@OR_E_GunBigBear,1541913907.0,1061168803218948096,"@mayrkay Whatever field you are outstanding in, please stay there. Quit drinking the water, it’s making you hallucinate.  ",0.017530261737493023,0.21992732046949945,0.05003758
267,extrapoint,@extrapoint13,1541915575.0,1061168803218948096,Make that 65.9 million  ,0.23010933203906125,0.12797272396063436,0.052769624
238,mgideon(USNR),@MgideonU,1541915994.0,1061168803218948096,maybe the next president can sign an executive order banning the mention of his name and removing from all government records.  ,0.13775546938640154,0.3452165560526144,0.04641597
268,shane is merry ,@veggiesnackss,1541916779.0,1061168803218948096,make that 7 billion  ,0.25169410122910485,0.17263124122712284,0.035191905
269,Dendi,@anakronistick,1541917194.0,1061168803218948096,Count me out  ,0.2995553219662237,0.02821374779002485,0.5554771
258,Brian Crypto,@crypto4days,1541920902.0,1061168803218948096,"Yes he could become a non person. Wow. Liberals need to read about how Lenin, Mao, Pol pot, Castro etc. came to power. It always starts with hyper emotional young people demanding socialism and ""fairness""  It always ends the same. So far over 100 million have died from socialism.  ",0.6068350100995982,0.4807875322910957,0.03538614
17,Robert Keehan,@robertokeehan,1541920908.0,1061168803218948096,"Replying to @realDonaldTrump There’s a lot of outpouring of disgust here which I can understand, but does anyone have any reliable information on whether Trump is correct in his assertions about forest management? It would be useful to focus on the argument not the man.  ",0.0903409585349374,0.3985286334949944,0.020027857
254,Fartface Von Sassbanana,@blazer_raid,1541923845.0,1061168803218948096,Replying to @realDonaldTrump   ,0.17570862623433728,0.03352323163434365,0.013172911499999999
257,Dembai BLM - ACAB,@LadyDembai,1541924533.0,1061168803218948096,As a Canadian note that we did this because we know how much your president likes KFC and hates things that take a swipe at him. All our love.  ,0.4362841109408995,0.4059802330989927,0.012324255
261,ChristopherHomokay (PARLER: truchrishomokay),@truchrishomokay,1541924902.0,1061168803218948096,"Replying to @realDonaldTrump Control North America’s beetle infestations with proper forest management, especially California where metallic beetles are killing healthy trees in a season & it’s not properly managed. I saw it in the Sequioa lodge pole pines. Beatles were in swarms & meanwhile Yosemite burned.  ",0.0027723320972527963,0.5234903702930314,0.046416726
458,Prin391  days. ,@prin391,1541925224.0,1061168803218948096,"When there’s a mass shooting it’s disrespectful to talk about gun control. Today a whole town is gone. Lives lost & countless are homeless, but it’s OK to place blame before the dead are even buried. Guess no thoughts & prayers for these victims. I say it again, I truly hate him.  ",0.5822325450081832,0.6415281977296066,0.54391545
456,Prin391  days. ,@prin391,1541925707.0,1061168803218948096,"I don’t blame you for how you feel. But please don’t put this on all Americans. Millions of us didn’t vote for him & are working our butts off to get rid of him. In the meantime, I truly love your beautiful country & will continue to visit. Today I am quite envious of you all.  ",0.1414313685464203,0.4917796744320718,0.031284165
