,username,userid,time,id,text,davidson,waseem,fountana
264,Moo,@AnewMoo,1541927151.0,1061168803218948096,"Replying to @realDonaldTrump Look at me, me, me... but not in the rain, because it’s wet. Look at me showing disrespect.  Look at me, not those that actually stood on the front lines when it was raining bullets. Look at me, a draft dodger. Look at me as my world around me is falling apart. Look at me..  ",0.9966349794198704,0.3117377910609707,0.031841673
476,James Castloo,@JamesCastloo,1541927276.0,1061168803218948096,When a gun tragedy occurs gun control is tops in the news before the names of the victims are announced. Where have you been?  ,0.17179760125681826,0.4286076185813557,0.08068368599999999
52,Incwell,@Incwell,1541927312.0,1061168803218948096,"Replying to @realDonaldTrump As compassionate as you are wise — federal government manages this branch. You are criticizing your own apathy. 

  ",0.1099154357355734,0.21035507436603945,0.05370954
275,Mr. J,@MrJ64760469,1541927346.0,1061168803218948096,"No
You used a wild animal to make a self serving point. No regard for the creature. Hopefully Trudeau will be a school teacher again in near future  ",0.013328271188558708,0.3862435659822587,0.033125624
477,Prin391  days. ,@prin391,1541928199.0,1061168803218948096,And every republican starting with trump says it’s disrespectful & too soon to talk about gun control. Where have YOU been?  ,0.07414630948833655,0.1521823455249758,0.107610494
263,John F Corbin,@JohnFCorbin,1541931212.0,1061168803218948096,"Correct assessment. They may not admit it, however I would venture a guess that those normal voters who cast their ballots for Trump thinking it can’t hurt are rueing their decision. A few thousand voters in just 3 states have placed the world in a holy hell. Horrible decision.  ",0.1572298785731834,0.6354844860355109,0.7208239000000001
18,Monica Silva,@monicasz2112,1541931331.0,1061168803218948096,"Replying to @realDonaldTrump Dear Mr. President, once again your comments are a gross mismanagement and I cant believe that I voted for u. But maybe you're right California should've done something about  this dry weather and high winds. Tell us how the hell would u threaten mother nature, Idiot  ",0.3289762931114361,0.5440452216497913,0.62080234
262,Melissa Colasanti-Preorder My Book!,@mmcolasanti,1541931438.0,1061168803218948096,These aren’t FOREST fires to begin with.  ,0.4246461928359748,0.06697689022882305,0.08608129
289,Charity Milam,@CharityBT,1541932706.0,1061168803218948096,You guessed wrong. Have you checked his rallies?  ,0.24423320685706915,0.11310480153923196,0.031324394
265,Kἶოἶղმz ,@jarringcreation,1541934078.0,1061168803218948096,He had no problem golfing in the rain!  ,0.33628233982530553,0.1189510009725824,0.10797395
53,To Pontiki,@TPontiki,1541935446.0,1061168803218948096,"Replying to @realDonaldTrump Hey idiot!  This is federal land protected by federal government!  Budgets to protect our environment and forests have been slashed by YOU!  However, instead of providing comfort to the thousands of victims, you find it more important to blame the state! U are a monumental POS!  ",0.012907584084952631,0.5737335631731598,0.24396700000000002
271,PaulBurnett,@PaulBurnett,1541935916.0,1061168803218948096,"Replying to @realDonaldTrump -from CalFireNews: “98% of the land burning is FEDERAL forest land, so yes, the mismanagement must come from the top of the federal government - let’s fire that guy! Largest fires in state history on your watch dufus dingle-berry...”  ",0.009320395404482977,0.4869763988089175,0.030138906
281,Marty Greer,@martygreer,1541937141.0,1061168803218948096,"Replying to @realDonaldTrump My cousin is a National Forestry team leader who leaves his fam for 2-week stints across the US to contain fires. His crew is top notch & usually have their area contained sooner. He doesn’t get paid much & operates on little sleep and gas station food. THAT’S a hero, sir.  ",1.796180796227062e-05,0.4941462868697745,0.03385843
282,Patty Mac-Smith,@psmith2026,1541938984.0,1061168803218948096,praise for your brother! Thank him for me.  He is a hero.  ,0.3784999483053664,0.22174927988237406,0.018187437
19,Julie,@Julie99265439,1541939394.0,1061168803218948096,Replying to @realDonaldTrump President Trump I voted for you and I like what what have done for our country!  I was born and raised in Paradise California and I am afraid you don’t understand the terrain.  Yes there are trees but not like you are thinking.  Please go visit and see for yourself.  ,0.5746694606651606,0.4435020470354095,0.008475251500000001
284,Rye,@ryethegirl,1541940113.0,1061168803218948096,Replying to @realDonaldTrump Interesting SINCE MORE THAN HALF OF IT IS FEDERALLY OWNED.....   ,0.07487537435736331,0.30679286556779445,0.015117907
286,Eric Townsend,@ETOWN58,1541943631.0,1061168803218948096,"Replying to @realDonaldTrump You should know as was pointed out by the President of Cali firefighters, YOU are responsible for cutting federal funds to the US FORESTRY DEPT who is responsible for 60 percent of Cal Forest Mgmt.  You are responsible for this disaster    ",0.00561120960236781,0.4077816723809879,0.032058645
285,mychaelpants,@alchemysm,1541945478.0,1061168803218948096,Hahaha-wrong.  ,0.13888760368308373,0.056280736263382015,0.3749595
288,"Lexi, Chrismakkuh Princess",@LexiOnFiyah,1541947595.0,1061168803218948096,Replying to @realDonaldTrump You are living proof of how privilege and money remove emotion and empathy from a person. This comment shows a moral and emotional unattachment to the people you are supposed to lead. EVEN SOME OF YOUR MOST CONSERVATIVE FOLLOWERS KNOW THIS KIND OF COMMENT IS EVIL AND WRONG.  ,0.21045679348982105,0.4923732738949426,0.10365289400000001
463,Linda Kazmir Pomeroy ,@MusicalMickey,1541950352.0,1061168803218948096," Quote TweetMrz Mazz@mrzmazz · Nov 11, 2018I have a couple questions. Is the camp fire on federal land? Doesn’t appear so on the map. Why do states with higher federal land ownership, like Nevada, not see this type of destruction year after year? What is the difference in the land management from state to state? ",0.07297943075948674,0.4553378752610581,0.034018278
293,Andy Milenovic,@_two3two,1541951658.0,1061168803218948096,"Replying to @realDonaldTrump How do u manage a forest? Do u even know what a forest is and how vast and large it is to even begin to be able to “manage” said forests? The funny part is, u want to build a wall to keep out the very people willing to do the work. Food for thought.  ",8.497922343271673e-05,0.3420846856149977,0.034255736
464,Marc 10er,@Marc10er,1541955408.0,1061168803218948096,"Nevada doesn’t have much forest. Bad example.

Camp fire is burning federal land. I believe it’s Plumas National Forest.  ",0.4748402824201906,0.3807674590549207,0.03255982
465,Mrz Mazz,@mrzmazz,1541956864.0,1061168803218948096,"Have you hiked in Nevada? Ever been to
Humboldt National Forest or Toiyabe National Forest? Have you been to Tahoe? Camp Fire is not in the Plumas National Forrest, close, but hasn’t spread that Far East.  ",0.012711646101045427,0.4375119312022214,0.01608483
292,HarleeTRUMPSTER,@HarleeTRUMPSTER,1541957097.0,1061168803218948096,"Totally wrong! Our esteemed President @realDonaldTrump is continually  finding real problems in need  of a turn-around to keep residents, First Responders, wildlife & property, safe from the devastation of wildfires. 
The #StatusQuo is unacceptable where human life is concerned.  ",0.003649240736059188,0.36944124033257,0.034974176
295,LucyLatina714,@LucyLatina714,1541961992.0,1061168803218948096,"Replying to @realDonaldTrump In case you didn’t know, the reason for these WILDFIRES is called, GLOBAL WARMING!!  Something you don’t believe in. All the devastating hurricanes, Tsunamis, earthquakes, floods, mudslides are a direct effect of GLOBAL WARMING!!
IF YOU LOVE THE WORLD & AMERICA, START BELIEVING!!  ",0.21343926650543107,0.5275953729040275,0.030175643
466,Marc 10er,@Marc10er,1541962193.0,1061168803218948096,"Nevada has far less forest land than California... cmon. A couple of great hiking spots don’t change pure land mass.

And yes... your picture illustrates my point. That green area, is park land... either national, state or local. In this case, that’s National Forest land.  ",0.025669239304442,0.7020782729296597,0.024219632
467,Mrz Mazz,@mrzmazz,1541963905.0,1061168803218948096,You need to get out more.  ,0.15321384764033374,0.08630750841619124,0.12141877
299,MRT,@MollyRoseTarpey,1541964288.0,1061168803218948096,"Replying to @realDonaldTrump The only thing more distressing than this tweet itself is the 117,000 people who liked it.  ",0.3865259509507165,0.13807306156601035,0.031166982000000003
468,Marc 10er,@Marc10er,1541964316.0,1061168803218948096,  ,1.7657473994997902e-130,0.01813247552960133,0.010068049
301,Pádraigín,@SketchBookGirl,1541964400.0,1061168803218948096,Replying to @realDonaldTrump How come I understand what you tweeted about the fires. You were not blaming. U simply feel that things need to be look into to possibly help in not so many 's with the dry climate.  ,0.03331996651507492,0.2622328282446516,0.010815223999999998
294,Pádraigín,@SketchBookGirl,1541964534.0,1061168803218948096,"Environmentalist can evaluate certain things that can be a catalyst to some many fires starting, other then dry weather. also since he's the president maybe he knows a little bit more that's going on and we do. Perhaps things that they don't tell the public.  ",0.1399684187660807,0.3911525083110757,0.040595986
469,Mrz Mazz,@mrzmazz,1541964560.0,1061168803218948096,"Okayyy... Wasn’t what we were talking about, but at least we established you can screen shot. How about photography? We need that for the road trip.  ",0.12058733857178773,0.27404120440313434,0.019345561
20,Leo Killion,@Leokillion,1541964718.0,1061168803218948096,Replying to @realDonaldTrump I’ve kept a lot of my thoughts and comments to myself about what you say. This statement is deplorable and disgusting. I hate how you conduct yourself as my president. There have been more days I regret voting for you then ever being proud of the work you do.  ,0.5231769659705303,0.3595423993035557,0.076270275
228,casey,@patseycline,1541964972.0,1061168803218948096,"Only people with blinders on are those that refuse to look for or listen to the truth. There are many ways to seek the information. Try it, you might b3 surprised.  ",0.3893768290448285,0.22941500450514335,0.01993038
303,Veni.che ,@ven1_che,1541971465.0,1061168803218948096,Replying to @realDonaldTrump $135 million of taxpayer money allocated for SIX (6) MILES of a border wall in TX to start in Feb? Yeah. Eff that.  ,0.01585223129967573,0.2640641617592865,0.04203696
21,Aquaria ,@aquariaofficial,1541971540.0,1061168803218948096,Replying to @realDonaldTrump ARE YOU FUCKING SURE YOU PIG? ARE YOU FUCKING SURE??????  I PHYSICALLY CANNOT EVEN UNDERSTAND THIS FUCKING NONSENSE. THE WORKD IS IN TEARS AND YOURE JUST SITTING ON YOUR SILLY SELF THINKING ITS A FUCKING TREES FAULT. HOW DARE YOU. LETS FUCKING FIGHT. ITS ON.  ,0.9998939109336524,0.182220434321617,0.95106894
302,Katy Richard,@richard_katy,1541971801.0,1061168803218948096,You can't be serious. He blamed them for the fires. He threatened them w taking away emergency funds. He said nothing about helping anyone. 25 people have died and he's concerned about money.  ,0.3368783168238305,0.19122308742907754,0.08044138
297,Rye,@ryethegirl,1541973324.0,1061168803218948096,You do realize what you posted supports what I said right?  ,0.11287640687581138,0.3718214524728116,0.05900085
300,UnfortunateASMR,@AsmrUnfortunate,1541973416.0,1061168803218948096,Yes but look at his followers then at the likes. Hopefully wont be reelected.  ,0.4667495911736214,0.2238895765651473,0.08201537
290,Charity Milam,@CharityBT,1541973979.0,1061168803218948096,"We get it.  You hate the president.  No need to keep rambling your incoherant ""reasons"".  ",0.3479250343261311,0.2535672644383821,0.5035013
306,Darin Sullivan,@darinsullivan,1541975001.0,1061168803218948096,"Replying to @realDonaldTrump Own goal you fool. The US Federal Government manages national forest in that State, so you're ultimately to blame. Take your own advice and resign, you are unfit for public service. Firefighters can see through smoke and morons and you are a lot of both. #LAFD #Campfire #LAFires  ",0.12926459248153538,0.4599493657853583,0.028105775
304,David P Frost,@cigalecigale,1541977339.0,1061168803218948096,"And, don't forget the over $210,000,000.00 to mass federal troops, at said border, just before the mid-terms. Disgraceful!  ",0.05109759126057115,0.1900411255327174,0.09669279
324,Veni.che ,@ven1_che,1541978437.0,1061168803218948096,"As a person who grew in a border town in Texas for a good part of my life (15 yrs), those troops will wonder wtf they are doing there because I guarantee it’s not the war zone certain ppl have painted it to be  ",0.2151064870134356,0.3626092484751252,0.14435042
316,TJ Agardy,@TjAgardy,1541979395.0,1061168803218948096,Ms. Asbergerette... insensitive to suggest these people follow him. Take him away and people would find someone even more logical to correct the disease cause by Obama. We never voted for the twit former pudster. He's corrected 30 yrs of  shit.    ,0.8904320225644153,0.27202400924235165,0.75077075
307,Jefferson Vickers,@1eydjax,1541983162.0,1061168803218948096,Replying to @realDonaldTrump I hope UR Scotland Course is the 1st tragedy of climate change. No that’s right we’re already loosing. UR so stupid U make rocks look brilliant. I sit here my car filled with 1/1000 of my memories & animals when told run.1day May u know the feeling of homelessness. 2020 works.  ,0.2079288508850189,0.5820888796711748,0.030268429
325,Raving_Sanity,@Raving_Sanity,1541987560.0,1061168803218948096,"As a person who grew up in a military town, Texas is going to regret getting those troops.  Nothing more dangerous than young men with guns and attitude and nothing to do.  ",0.06628590345641387,0.23630034811464085,0.14348605
313,Tracy Elmer,@telmer,1541987795.0,1061168803218948096,"Replying to @realDonaldTrump There are actually many reasons that have nothing to do with government or forest management. Let's start with geography, drought and wind. Can you please choose people over politics? Victims of the fire, those who support them and our first responders need help not threats.  ",0.0016955160479614154,0.38533017917752105,0.015187858
314,Tim Copeland,@timmytoma,1541991714.0,1061168803218948096,https://canadafreepress.com/article/ca-gov.-jerry-brown-vetoed-bipartisan-wildfire-management-bill-in-2016…  ,0.9872066881656401,0.03458494004408244,0.01986244
317,UnfortunateASMR,@AsmrUnfortunate,1541993522.0,1061168803218948096,"Excuse me, are you saying i have aspergers?  ",0.2168776509840064,0.10346702441959847,0.6674207
326,nortibia,@nortibia,1541993714.0,1061168803218948096,"The professional military sent, I won't say anything bad about, but the self-proclaimed militia groups, is nothing more than guntriggered beer drinking racisists hoping to get the chance to shot at brown persons.  ",0.020303549096684585,0.6244298171196087,0.77509606
327,nortibia,@nortibia,1541995839.0,1061168803218948096,"You seems gullible, and nothing wrong with that. But militia is rarely good for anything, unless a zombie invasion, etc THIS is not an invasion. They wish to apply legally.  ",0.0030687523819168928,0.4372020346391549,0.06436383
315,DG,@libgwenchy,1542002346.0,1061168803218948096,Replying to @realDonaldTrump   ,0.17570862623433728,0.03352323163434365,0.013172911499999999
308,S_Blueberry,@Blueberry_Sara9,1542006643.0,1061168803218948096,Stay safe Jefferson. I'm so sorry....  ,0.07238142523729826,0.1941172610861779,0.06303865
328,Alice Olson,@NosaraNumberOne,1542010647.0,1061168803218948096,"Zac, the ""management"" problem T complains of is with the fuel sources, not the ignition. He seems to think if CA forests were better managed there'd be fewer and less dangerous fires. He forgets he's in charge of that, as more than half are federal forests.  ",0.3982269702546037,0.4792681532551842,0.0353956
22,brandoncarlo,@fortifiedwhine,1542023660.0,1061168803218948096,"Replying to @realDonaldTrump Did you just threaten to let California burn AND blame them for their wildfires? You're the president of the United States not the states you won. This is disgusting, but I guess it's a lot easier for u to blame these fires on Jerry Brown than to blame those gun deaths on the NRA  ",0.024130288890200854,0.597403117134587,0.4639951
23,Michelle Litzau,@Leavememal0ne,1542024992.0,1061168803218948096,Replying to @realDonaldTrump The point here @realDonaldTrump is that IT IS HAPPENING! And it's not anyone's fault! There doesnt always have to be a fault! Things happen and this fire is destroying families and lives!! But I forget that you sir dont even care about that! All you care for is business and money  ,0.9344488658920296,0.4084741763180307,0.13382815
460,JJ Fahrni,@JJFahrni,1542036153.0,1061168803218948096,"Replying to @realDonaldTrump The reason for these massive, deadly and costly forest fires is they are having a drought - no rain. Remember, you serve the people who are fighting these fires. Support not threats are needed.  ",0.05858367010223815,0.31070379595231074,0.011736456000000001
319,Lisa M,@LMET1111,1542037089.0,1061168803218948096,Replying to @realDonaldTrump This tweet shows how uniformed and ignorant you truly are. The FEDERAL government manages over 60% of California forest lands. There is a thing called DROUGHT (that means no water). I live in CA and I am still wearing shorts and tank tops due to warm weather. NO WINTER HERE.  ,0.0004808125747711629,0.4684309257907375,0.02410738
322,BassChick,@stringbasschick,1542045700.0,1061168803218948096,"Replying to @realDonaldTrump Unlike you, Californians pay their federal taxes. We should pull the funding for your gold trips.  ",0.2832004222871172,0.2872966208457477,0.019808838
321,William Chamberlin,@bgbdbill67,1542047365.0,1061168803218948096,"Glad you know your seasons!
We are in Fall not Winter!
Fall began Sept.22 and Winter begins December 21.
72° days with 45° nights, sounds about standard for fall weather to me!!!  ",0.010562222659782863,0.24612958206073185,0.03649977
333,Sinoda Duque,@peonixfire,1542052105.0,1061168803218948096,Replying to @realDonaldTrump Is America great yet?  ,0.020428801351855427,0.25287539988717644,0.015337418
24,Michael J Zanoni,@zanoni_j,1542054964.0,1061168803218948096,Replying to @realDonaldTrump CA should simply secede and become their country or other blue states can secede with them... then theyll have plenty of $$$ instead of subsidizing red states.  ,0.0068473782499208855,0.535916754095099,0.015343166
340,Motleysue,@Motleysue,1542056805.0,1061168803218948096,"Replying to @realDonaldTrump How can you live with yourself.-You heartless bastard.  25 people confirmed dead - 100’s missing, thousands have lost their homes.  You disgust me #fucktrump #NotMyPresident  ",0.4866723776898288,0.3960988177697965,0.92044896
348,jimmyhobo,@bindlebaby,1542057080.0,1061168803218948096,"Replying to @realDonaldTrump just when we thought you could go no lower, bam, you do  ",0.10633159170735418,0.22629140971638054,0.20455518
459,Gobsmacked No More!,@4everResist,1542064456.0,1061168803218948096,"It’s hopeless. He never made it past 9th grade science.
#TrumpNoComprendo  ",0.09455449003981303,0.1823808386724389,0.0772933
25,Debbie Z. Bowler,@deborahzbowler,1542066389.0,1061168803218948096,Replying to @realDonaldTrump Stop cutting Federal Funding for National Parks and Forests and maybe they would have the means and manpower to maintain our beautiful forests.  ,0.02749614776580233,0.2853234140079626,0.015775051000000002
342,Tiffany Girard,@tiffany_girard,1542067166.0,1061168803218948096,"Gee William, thanks for that valuable information. We have to remember what really matters, which is obviously the exact date we transition to winter from fall. Definitely not worth talking about the actual point of the tweet. MAGA, right??  ",0.0010886873640667237,0.31651138471266904,0.028554073
26,Jewell40289493Resist Remove Replace Remember,@Jewell40289493,1542071243.0,1061168803218948096,"Replying to @realDonaldTrump THIS IS YOUR JOB IDIOT

Since you are so woefully inadequate

Resign

We don't need you

We don't like you

We will never trust you

We don't respect you

Resign

We will be fine without you  ",0.9927669344951692,0.181916983968676,0.78011996
479,Jewell40289493Resist Remove Replace Remember,@Jewell40289493,1542078564.0,1061168803218948096,2nd grade  ,0.1904594016802082,0.04344138501132694,0.027983801000000003
334,Warrior Womoon,@WarriorWomoon,1542079662.0,1061168803218948096,"Don't know about you, but a lot of us are not in Wall Street Investor financial bracket. I certainly won't be profiting from the Dow Jones going up. How about how the rest of us - the 98% - are doing?? Use *that* to figure how strong ""the U.S. economy is doing!!!   ",0.011720576309478151,0.23616753204048302,0.052174967
27,Regina,@dustm1991,1542086501.0,1061168803218948096,"Replying to @realDonaldTrump I agree with r President, When it comes to r forest here In Ca. r Gov. needs to make sure the dead trees/plants/weeds r cleared, they r just fuel for the fire's, maybe the families need to start suing, something needs to be done...  ",0.6625999154373272,0.2881291783474043,0.01576358
28,Ellie Rebecca,@SmileItsEllieee,1542095114.0,1061168803218948096,Replying to @realDonaldTrump forest management is done BY THE FEDERAL GOVERNMENT IN THAT STATE  ,0.17462407680312533,0.2018336508048769,0.012144023
350,Kathy Holmes,@kmeholmes,1542097362.0,1061168803218948096,Replying to @realDonaldTrump https://redding.com/story/news/2018/11/11/trump-blames-state-fires-but-many-worst-federal-land/1971196002/…  ,0.9836278620200168,0.08117062755835677,0.035628315
349,Agnes Robin,@robin_agnes,1542097460.0,1061168803218948096,He's in some distorted competition w/ himself on this soo.....  ,0.44373753091331664,0.1672452804178673,0.42593807
357,Janmcmahon,@Janmcma17675624,1542099135.0,1061168803218948096,Replying to @realDonaldTrump Maybe you should help the California's...send in the national guard...  ,0.02349964601590754,0.4870204661774505,0.013978385
480,Silver,@SilverPearlWolf,1542099167.0,1061168803218948096,He never entered a science class  ,0.09766712445837396,0.07596110052806332,0.028456677000000003
358,gracie  #worryalittleless,@graceembrnll,1542099777.0,1061168803218948096,Replying to @realDonaldTrump right- do hurricanes happen because we aren't taking care of the sky? do tornados happens because we're not taking care of the ground? #anyoneelse2020  ,0.20230190869551476,0.2166002428350288,0.02694495
80,Michael ,@MichaelLaurin5,1542101594.0,1061168803218948096,Replying to @realDonaldTrump We have the same problem in Montana. We have thousands of acres of dead beetle killed pine trees & every time someone wants to clean them up some environmentalist files a lawsuit to prevent cutting. This is a disaster in the making  ,0.1484371507077276,0.4595544404452738,0.6611331
359,Alex Carl,@Alexgr8white,1542104945.0,1061168803218948096,"Replying to @realDonaldTrump CA owns only 3% of forests in the state, everything else? FEDERAL, which means CA abides by FEDERAL regulations set forth.  ",0.09389977333369244,0.3179357080801485,0.01239585
361,Janet Tremlett,@MusickTremlett,1542105052.0,1061168803218948096,"Replying to @realDonaldTrump Sir, you don’t even know what’s going on in CA.  Why don’t you come out and see for yourself?2/3 of the CA “forests” are owned by the federal government and private http://individuals.You and Congress set the budget for fire management.  ",0.1528751639639906,0.3705959520958888,0.017023278
145,Stephani,@Steph_A_Nanny,1542111069.0,1061168803218948096,"I’m so so sorry to hear about your missing family members! This is devastating. I live in LA but if there is ANYTHING I can do, I will  ",0.2095975672243369,0.17955967766872916,0.015913693
363,Susan Simms,@Susan12409,1542111946.0,1061168803218948096,Replying to @realDonaldTrump Please do some research. That part of our country has been experiencing a drought. You really should research before tweeting. Our first responders are working tirelessly to remedy this situation and you are threatening their resources. Seriously?  ,0.007758490059121589,0.23350141408859376,0.030657081
146,Christina Taft ,@XTinaTaft,1542111952.0,1061168803218948096,"What can be done? The city and PG&E were gross negligent and negligent in general. 

No calls to Zone 6 which is destroyed, firefighters not allowed in, no rescue of ppl who couldn't told to me at 12pm 

I can make GoFundMe?? 

#campfire #fires 

Lawyers?? #paradise Victoria Taft  ",0.19414949140867002,0.6495510183308446,0.036664743
365,Ky Williamson,@ky_williams2,1542112051.0,1061168803218948096,"Replying to @realDonaldTrump Trump + GOP 100% causing WILDFIRE DISASTERS in CA + SW DROUGHTS + Cat 6,7 8 hurricanes by DENYING GLOBAL WARMING.  US LEADING 3rd world +100 yrs USA Industrialization's + DENIAL SCIENTIFIC FACTS PROVEN beyond ALL preponderance of EVIDENCE US FED COURTS req. ='S MASS MURDERS NOW  ",0.08039770341230956,0.6487664865759308,0.038288776000000004
147,Stephani,@Steph_A_Nanny,1542112578.0,1061168803218948096,I literally have no answers but this is absolutely appalling and heartbreaking and things need to change. Have the news stations been contacted?  #SoCalFiresJamesWoods  ,0.0346443345913958,0.12743355067440193,0.024113001000000002
