,username,userid,time,id,text,davidson,waseem,fountana
235,Yoni ,@civilwithyoni,1584910764.0,1241659689970077696,Replying to @those_rimshots It’s not racist. China is a location and this virus originated from that location. Racism is the belief that one race is superior or inferior to another. Where in the term China virus does the intent of “my race is better than yours” come through?  ,0.09500242012817113,0.6460140681062153,0.31159467
244,Yoni ,@civilwithyoni,1584912097.0,1241659689970077696,What do you mean like China virus vs corona virus?  ,0.07881439033870635,0.1946164632295716,0.029404147999999998
215,Phillip Anthony,@PhilAnthTX,1584912204.0,1241659689970077696,"Replying to @those_rimshots Idk. FWIW, Spanish is a language. Chinese is not a language.  ",0.05848446338599631,0.12662213511342768,0.09688815
245,Yoni ,@civilwithyoni,1584912229.0,1241659689970077696,I don’t find that confusing at all. Do you find corona virus and Covid-19 confusing ?  ,0.0607381911327917,0.0776205471186969,0.025863726
246,Yoni ,@civilwithyoni,1584912984.0,1241659689970077696,"I really don’t think it’s confusing. We’ve been hearing all of these interchangeably from the start. China virus, wuhan virus, coronavirus , COVID-19. If you don’t understand China virus and what that’s referring too I’d honestly be worried about logic capacity.  ",0.005746599429187849,0.29096317128726634,0.0337542
247,Yoni ,@civilwithyoni,1584913295.0,1241659689970077696,There’s really nothing left to discuss on this topic. I think if you can’t equate China or wuhan virus to corona virus then that’s a personal issue.  ,0.5581968453544369,0.31268948993772594,0.03437701
248,Yoni ,@civilwithyoni,1584913443.0,1241659689970077696,There isn’t. And there is. Depends on your political views.  ,0.026235978494630764,0.21196447355703826,0.04796641
249,Yoni ,@civilwithyoni,1584913643.0,1241659689970077696,Great. Sounds good  ,0.025141662637393054,0.034888560027761605,0.028386277999999997
216,Nicole Eugene ,@NCEugene,1584915469.0,1241659689970077696,"Replying to @those_rimshots Naming diseases by associating them with a group of people stigmatizes the group of people. “Gulf war syndrome” was really PTSD, but we just didn’t know enough about it and had a limited view of the problem. The name “Spanish flu” reflects the naive era. We should know better now  ",0.5550503858943145,0.4111252578686781,0.08422586
217,Nicole Eugene ,@NCEugene,1584915538.0,1241659689970077696, The following media includes potentially sensitive content. Change settingsView ,0.03690415920421193,0.07223923660948509,0.02287087
218,Mae Villa-Agustin  ,@mae_g3,1584916719.0,1241659689970077696,"Replying to @those_rimshots Quite honestly, I don’t mind either way. I’m of Filipino descent, not Chinese but if it was called the Filipino Virus, I don’t care.. its still the same virus and has the same medical effect of humans regardless of its name. Let’s put things in perspective.  ",0.03050365603402169,0.6803230883879132,0.030328427999999998
219,Mae Villa-Agustin  ,@mae_g3,1584916784.0,1241659689970077696,U can’t breath and not offend anyone anymore nowadays. It’s just a name. It’s effects are a more important topic to talk about. #priorities  ,0.011627332621811072,0.2170575206976899,0.11189292
220,andromedaxnz,@andromedaxnz,1584920370.0,1241659689970077696,"Replying to @those_rimshots It's not that simple. You need to consider what it can lead to.  Take a look into the history of anti-Chinese laws and crimes in the US.  A few examples:
The Chinese exclusion of 1882
Murder of Vincent Chin
The Rock Springs massacre
The Chinese massacre of 1871 in LA  ",0.007287772991831288,0.6591020564539333,0.025110392000000002
221,Chau Dosi ,@wolleynder,1584929249.0,1241659689970077696,Replying to @those_rimshots Is calling it the Spanish Flu causing any Spanish or Spanish speaking people to get beat up? Is the “Chinese virus” name getting Asians beat up? Yes  ,0.5955213972359078,0.3011911118585809,0.080822036
266,Unfelt Sorrow,@unfeltsorrow,1584930818.0,1241659689970077696,"Replying to @those_rimshots Spanish Flu is believed to have originated in Kansas, USA. Many countries downplayed their figures to avoid affecting wartime moral. Spain being neutral had no restrictions, appearing to have far more cases (hence the label). Swap Spanish for American & run your survey again.  ",0.005973032382206696,0.6024000531604016,0.013406679
222,Bernard mcGlynn,@BernardMcglynn,1584931282.0,1241659689970077696,"Replying to @those_rimshots Saying Chinese virus?? Which one? this isn't the first virus to originate in China! It's got a name! Like if I'm talking about Jackie Chan, I don't just say, the Chinese actor and expect that to suffice. ""Corona"" , it's got 6 letters ""Chinese"" has 7.  ",0.4769147862279948,0.2863740237440113,0.044444352
74,Keiren,@Keiren22975879,1584932699.0,1241659689970077696,It s true. It is not the word but the intention  ,0.07675714206277101,0.3422133203245578,0.050490607
223,R,@rd01886777,1584994637.0,1241659689970077696,Replying to @those_rimshots This comparison is like comparing apples to oranges. Both are fruit but of completely different context and vernacular ...  ,0.016417553639695968,0.29930388153365584,0.012389583000000001
224,Jordan R,@Jordan13Coops,1585353083.0,1241659689970077696,Replying to @those_rimshots The Spanish flu didn’t originate in Spain or any other Latin or Spanish country.  ,0.013919582293243457,0.3999556623458957,0.07366506
