,username,userid,time,id,text,davidson,waseem,fountana
193,Keith C. ,@kcinca2003,1584877739.0,1241659689970077696,"Replying to @those_rimshots We must understand why a name is used as to its intent. Spanish flu is so named not to cause responsibility to Spaniards, but because of less restrictive reporting. Why was the 1918-19 pandemic that killed 50 million people known as 'Spanish Flu'?The Spanish Flu pandemic killed an estimated 50 million people over three killer waves that spread throughout 1918-19, and infected a third of the world's population. But the deadly virus did not...historyextra.com ",0.0001819330483814093,0.7410208965613939,0.01289997
194,Keith C. ,@kcinca2003,1584877870.0,1241659689970077696,"Once you have that understanding, you can then determine its reasoning for being used. I’ve asked what the reasoning of the new name and what profits of calling it this in lieu of Covid 19 or coronavirus. The intent is weak at best, and that is why it should be stopped.  ",0.013762814344358195,0.4249031145775984,0.021806061
195,Toshi ,@FollowerToshi,1584878453.0,1241659689970077696,"Replying to @those_rimshots I don't think so, cause the Spanish Flue was referring to Spain, not Mexico or other South American countries, and Spain is chalked full of white people. Whereas Chinese Virus can be seen as a direct slightly against a different race of people.

At least, that's my process.  ",0.7543315367069929,0.5920311455822219,0.06349024
12,Stina B,@stinabeaumont,1584878669.0,1241659689970077696,Or we can just call it Coronavirus.  ,0.11853021801816413,0.1951499901821612,0.020309284
58,Moon,@Lilmooner32,1584878671.0,1241659689970077696,The Swine Flu started in Mexico....  ,0.35077007370923224,0.20843849529045927,0.021193404
21,Sarah,@smoothieDub,1584878839.0,1241659689970077696,"That’s what I call it too, the coronavirus.  I’m just making the point that some people might call it the Chinese virus in passing.  No offence to anyone.  Just saying it casually.  ",0.08489037804637936,0.33905007488468103,0.05378656
196,T KhonLao ,@savandistrict,1584879198.0,1241659689970077696,"Replying to @those_rimshots The Spanish Flu is very unique from what scholar said originated in Kansas during the Spanish American War. So it should have been American Flu . Max wartime propaganda at work during the war crisis, deja vu in a different ways here with Trump.  ",0.014863297708479875,0.7815401473613319,0.03623065
72,The Zinger (Michael),@Zen_Zinger,1584879744.0,1241659689970077696,"Replying to @those_rimshots Yes, especially because the Spanish flu didn’t even originate in Spain!!! 

Also let’s ask ourselves... if a lethal virus started in a European country , like Russia, would we call it the “Russian virus?”

Would Russian-Americans be told to go back to Russia and stop eating sh-t?  ",0.028611258827590236,0.5540309860545609,0.043443844
68,Ben,@onnahill,1584879947.0,1241659689970077696,First detected in the United States 2009 H1N1 PandemicA summary of key events of the 2009 H1N1 pandemic and the CDC's response activities between April 2009 and April 2010.cdc.gov ,0.001511918714129207,0.16753397369959094,0.020789513
197,vyxel   | UBI = Prosperity for All,@vyxel_,1584880200.0,1241659689970077696,Replying to @those_rimshots MAGA hats are Chinese hats   ,0.016010925649848767,0.24055885543426545,0.057976655999999994
60,Mr Weeks ,@Mr_Weeks_OG,1584880293.0,1241659689970077696,"I'm sorry, but my only understanding is we call it the chinese virus because it came from china. What am I missing?  ",0.7441706749201438,0.2734491035244642,0.05441807
69,Moon,@Lilmooner32,1584880724.0,1241659689970077696,"https://virologyj.biomedcentral.com/articles/10.1186/1743-422X-6-207…

It may have been detected in the US, but, it originated in Mexico. From where did the 2009 'swine-origin' influenza A virus (H1N1) emerge?The swine-origin influenza A (H1N1) virus that appeared in 2009 and was first found in human beings in Mexico, is a reassortant with at least three parents. Six of the genes are closest in sequence...virologyj.biomedcentral.com ",0.0067086779756129825,0.4856306597207402,0.11974733
258,Grant,@gstro,1584881057.0,1241659689970077696,"Replying to @those_rimshots Trump is using demagoguery just like in 2016 to garner voter support. Instead of attacking Mexican immigrants, he's attacking Chinese to shift blame from himself. COVID is not a problem in Taiwan which neighbors China. U.S. had 2 months to prepare for pandemic.  ",0.3016000444745912,0.6303986779644931,0.02859309
73,Sahrin!!! ,@SahrinOvO,1584881144.0,1241659689970077696,Replying to @those_rimshots I don't think it's racist I just think it's stupid and uninformed  ,0.1039777574121592,0.20078066367455133,0.554818
233,Delancey,@afortunatestory,1584881274.0,1241659689970077696,What do you think about the theories of it being an innocent screw up from the lab in Wuhan?  ,0.30591826711593184,0.2991430929181834,0.16629334
22,Stina B,@stinabeaumont,1584881336.0,1241659689970077696,"@dubliner84 sry, wasn’t trying to sound curt or offended. Literally wanted 2 respond more but had 2 post quick & go bottle feed a stray kitten we found last week.  ",0.004999071081141151,0.2326733995622889,0.044197977
80,The Zinger (Michael),@Zen_Zinger,1584881371.0,1241659689970077696,So you think random white ppl would be assaulted and told to go back where they come from?  ,0.9831045088138338,0.19387158090870826,0.61806196
198,Gal_in_Sac,@sac_gal,1584881564.0,1241659689970077696,Replying to @those_rimshots The Spanish flu didn’t start in Spain.  ,0.21344396583447856,0.20939614299205586,0.10491696
85,Sahrin!!! ,@SahrinOvO,1584881625.0,1241659689970077696,Which proves my point in a way lol. It's stupid and uninformed (tho given that was a hundred years ago spanish flu may actually have been racist)  ,0.8728572652165779,0.3943436028796803,0.7784761
23,Sarah,@smoothieDub,1584881670.0,1241659689970077696,Glad you’re not offended.  I agree with you.  It’s hard not to love little kittens  ,0.8765785735519775,0.05482837697885306,0.029234088999999998
86,Sahrin!!! ,@SahrinOvO,1584881889.0,1241659689970077696,"As an American if patient 0 of a virus was here I wouldn't mind it being called the american virus, but thats just me  ",0.5484985984000973,0.4602494052322439,0.111077644
158,Bo Pingvin Ullersted ,@BoPingvin,1584881923.0,1241659689970077696,"Replying to @those_rimshots Everyone saying Spanish flu didn't originate in Spain:
Yes, but people didn't know that back then. 
The first news reporting regarding the disease was when the Spanish king got it. 
Also, Spain was one of the few countries where the press was free to report on the disease...  ",0.001377076430574622,0.4717731337951663,0.025813121
87,Sahrin!!! ,@SahrinOvO,1584882021.0,1241659689970077696,Fair fair  ,0.1113182959689872,0.030704579237551224,0.3736216
159,Bo Pingvin Ullersted ,@BoPingvin,1584882039.0,1241659689970077696,"...which of cause made it seems like Spain was hit way worse than the countries fighting in WW1, who would order their press services to massively underreport deaths due to ""Spanish"" flu, for propaganda reasons. 
So people had good reason to think of Spain as the epicentre.  ",0.08019744806312971,0.5969511826408669,0.04800118
160,Floridaman,@Rogerma46478074,1584882090.0,1241659689970077696,"Replying to @those_rimshots The US has ongoing issues with China. The better example is if something was called the Mexican Flu. Cubans, Puerto Ricans, Chileans and such would be attacked and told to go back to Mexico.  ",0.01478172633219793,0.512583622861182,0.060440052
161,BiBi,@bebi_lovely,1584882289.0,1241659689970077696,Replying to @those_rimshots Have you ever seen white people get racism treatment? I meant depends on the circumstances and the ethinicity..  ,0.9458189515627541,0.2603053485400239,0.05997224
70,Ben,@onnahill,1584882340.0,1241659689970077696,"The conclusion of this article clearly states “probably in Mexico”. And inconclusive because of lack of testing in herds across Africa etc. 

It’s semantics. All of it’s semantics. That’s my point, call it H1N1. Call it Covid19. Call it what the fucking scientists call it.  ",0.9804206275805516,0.4535828999579522,0.8257327
199,The Worst ,@Rhejde,1584882584.0,1241659689970077696,"Replying to @those_rimshots If the first is true the second is also true, but I don't believe the first is true.  So Yes and No :)  ",0.008319455720034527,0.24993370068950854,0.10095342
200,The Worst ,@Rhejde,1584882726.0,1241659689970077696,"Which is not to say that it's productive to call it ""Chinese Virus""... But it's not directed at a person or individual. It's the country of origin.  Wreckless/uninformed choices by people regarding food safety in China is causing mass death and the world's economy to crash.  ",0.002715504202000034,0.5884018292367296,0.040771037
201,Joseph Patrick ,@JoeyGDNBoss,1584882898.0,1241659689970077696,"Replying to @those_rimshots Yes, it's 100 years later and segregation was abolished since then. Also it didn't originate in Spain.  ",0.21313412158558212,0.33154383646780605,0.030370513
202,roscochops,@roscochops,1584883769.0,1241659689970077696,Replying to @those_rimshots Its his motivation behind calling it the Chinese virus that is the problem.He's very deliberately trying to brand it the Chinese virus to counter the insinuation made by the Chinese that patient zero was an American soldier at the Wuhan military games in november  ,0.0016709039654871805,0.6264055335026443,0.077722885
64,Elzy ,@Elzy52643422,1584883777.0,1241659689970077696,I don’t know why people can’t just call it the coronavirus or COVID19. It’s childish  ,0.3904302172942915,0.3708533738560632,0.17379473
81,The Zinger (Michael),@Zen_Zinger,1584884273.0,1241659689970077696,"You’re comparing a religion to race which is a false equivalency. 

Yes, I know Jewish people have been discriminated against. However none of my Jewish and white friends have ever been assaulted because of their race or told to go back where they come from.  ",0.7251751061998457,0.7096596037833043,0.09295167
203,Khoa Ly,@Koalee110,1584884394.0,1241659689970077696,Replying to @those_rimshots Calling it the spanish flu has no repercussion today. But if you remember the AIDS virus. No one knew where it came from.  But newspaper were quick to say it came from homosexuals. That lead to deadly beatings and attacks on homosexuals. Think about it.  ,0.1756575849912632,0.6544813620163037,0.031033281
204,Kalgor,@Kalgor91,1584884829.0,1241659689970077696,"Replying to @those_rimshots The Spanish flu didn’t start in Spain and didn’t disproportionately effect Spain so yes, it’s also racist to call it the Spanish flu. The only reason it’s called that is because the rest of the western world was involved in WW1 and censored the press, but Spain was neutral.  ",0.002283672401707584,0.5749387396812825,0.2483616
205,Tyler Stimson,@tylerstimson,1584884981.0,1241659689970077696,"Replying to @those_rimshots The ""spanish"" flu didn't even originate in Spain.  ",0.2323209254248517,0.2326299897607016,0.092668764
165,Kubernetes,@deepblue868,1584885207.0,1241659689970077696,"Replying to @those_rimshots How we call 2009 h1n1 pandemic ?https://cdc.gov/flu/pandemic-resources/2009-h1n1-pandemic.html…
""CDC estimated that 151,700-575,400 people worldwide died from (H1N1)pdm09 "" Where is this virus originally broke out ?! Think harder! 2009 H1N1 PandemicA summary of key events of the 2009 H1N1 pandemic and the CDC's response activities between April 2009 and April 2010.cdc.gov ",0.4568092443111176,0.3121600316628145,0.088199556
166,Recyclersrealm2#YGAKwith,@recyclersREALM2,1584885276.0,1241659689970077696,Replying to @those_rimshots The spanish were pissed about it too.  ,0.5817224373458016,0.14967515068419998,0.91539353
71,Post-Truth is Pre-Facism,@sar_bear77,1584885418.0,1241659689970077696,"The WHO chose not name the virus after a place as it could lead to unfair stigma. In 1918, we did not have an ability to share info as fast as we do now. Calling it the Chinese Virus now is intentional to gaslight the left and blame someone else. Clear intent is the difference.  ",0.21130413144607535,0.5393931404681426,0.029114066
167,Michael Haines ,@MichaelHaines20,1584886125.0,1241659689970077696,Replying to @those_rimshots In the mouths of some it is. And in the mouths of politicians it is also deflection  ,0.17702928734240594,0.4008492655400263,0.0347815
82,The Zinger (Michael),@Zen_Zinger,1584889114.0,1241659689970077696,"Most don’t know that more ppl were actually “butchered” in Asia than in Europe during WWII. That’s rarely taught in American history. 

My opinion still stands that Americans wouldn’t be assaulting white Americans if the virus originated in Europe. Trump wouldn’t blame them.  ",0.8961183033829947,0.6723199791858089,0.1863675
168,Nave...,@NaveThaShade,1584889178.0,1241659689970077696,Replying to @those_rimshots Ebola is named after a river in Africa.  ,0.2266202912648169,0.19803488353110005,0.01668695
169,Alonso A,@WaifusTrash,1584889309.0,1241659689970077696,"Replying to @those_rimshots Tbh; if it was called the Chinese flu I wouldn't find it as racist. I think it's the word ""virus"" that makes it sound worse.  ",0.03163217306552652,0.2715150308568222,0.37361273
65,𝕀𝕟𝕕𝕪 ℙ𝕖𝕟𝕕𝕒𝕟𝕥 ,@TIndependent20,1584889325.0,1241659689970077696,That's fine too. Please don't call it the Chinese virus.  ,0.05724865766929114,0.11434871611425332,0.08372141
236,hayanحيَّانْ,@HayanImd,1584889639.0,1241659689970077696,Replying to @those_rimshots I feel like this is a lazy equivalence argument that is coming from somebody who's defensive because they were called racist. Weaponizing terms like Chinese virus contemporaneously only serves to stigmatize Asians TODAY. A debate about a particular name in history is separate imo  ,0.17349879389301198,0.6118304048069003,0.3358759
237,hayanحيَّانْ,@HayanImd,1584889798.0,1241659689970077696,"This is the issue with the term ""racist"", it serves as something to point out about somebody's character rather than identity the issue with associating Chinese people with the virus.  ",0.6612393086866294,0.2194740230206859,0.07407042400000001
66,Elzy ,@Elzy52643422,1584890115.0,1241659689970077696,Agreed  ,0.3508522393853486,0.03151806357842585,0.05454931
170,SFbayareaYangGang≥,@FbayareaS,1584890656.0,1241659689970077696,"Replying to @those_rimshots In this current climate, yes it’s racist. @karenhunter explnd it well in her podcast, someone called in to her station. I commend her for her understanding despite not being AsAm. I wish ppl would see this. Theres been uptick in violence against AsAm as result of this @3rdHausSon  ",0.5343911030161349,0.4126276457676633,0.06774884
171,yanggang canada ,@zhjnrbx,1584890984.0,1241659689970077696,Replying to @those_rimshots Let’s call it #CCPVirus  ,0.21881753674782992,0.18238215833169066,0.08047251
259,Joseph,@turboslowdown,1584891097.0,1241659689970077696,Replying to @those_rimshots The Spanish Flu started in Kansas you walnut brains  ,0.35527494575902785,0.3841660014608537,0.82139194
172,WarriorForHumanity,@Human0137925504,1584891178.0,1241659689970077696,"Replying to @those_rimshots The Spanish flu originated in the US,  but the Spanish were the first to report on it . Also the virus wasn't be called the ""Spanish flu"" by someone (trump) who has repeatedly been rasicist  ",0.02093138579577028,0.3901598616564324,0.042633217
260,Richard Hartwell ,@rahartwell,1584891512.0,1241659689970077696,Replying to @those_rimshots Actually swine flu was the US pig farm flue.  ,0.02761849762308386,0.16667133228190045,0.08024833
261, Ms. Mileena ,@MSMileenaa,1584891899.0,1241659689970077696,"Replying to @those_rimshots No.

Neither ""Chinese"" nor ""Spanish"" is a race. There are three races: Caucasoid, Negroid and Mongoloid. The rest are ethnicities. You could make the argument that it's bigoted.

Unless people think Trump is stupid enough to believe Chinese = All Asians. Which he might be.  ",0.1327597141281978,0.7381082963692461,0.0921445
262,robert quire jr (jerk/jackass),@tricky2747,1584892324.0,1241659689970077696,Replying to @those_rimshots Why does everybody have to make everything racist? That’s why racism won’t go away.  Everybody wants to keep it alive by saying everything is racist.  Fucking pathetic.  ,0.41874154826888943,0.3581448951143586,0.95635885
173,whatever it's cool ,@mmmbcn1,1584894335.0,1241659689970077696,Replying to @those_rimshots I believe it's the intent on why you choose the name you use. I suspect most people saying Chinese virus do so intentionally to be inflammatory and /or racist.  I do not belive that is the intent when people say Spanish Flu.  ,0.27924589973527386,0.5373294479324942,0.036564127
162,MAGA 2020 INFJ,@introverts4yang,1584894909.0,1241659689970077696,"Replying to @those_rimshots Yes it’s Racist, for example The Spanish Flu did not come from Latin, or South America. It’s started in the United States.  ",0.5315960996762791,0.4874248434210563,0.08209367
163,philosoNestor,@philosoNestor,1584895213.0,1241659689970077696,"Replying to @those_rimshots No, but harassing Chinese or Spanish people based on that terminology is for sure a racist side effect.
The term itself isn't racist, but the actions that it inspires certainly can be, and that's the real problem here.  ",0.7868018966167113,0.5743312248471596,0.43083826
164,Zero of Hats,@Zero87552330,1584896784.0,1241659689970077696,Replying to @those_rimshots Spain was neutral in world war 1 so they had open coverage of the flu and in the time referred to it as french flu in their own reporting. France had no accounting to prevent loss of morale.  ,0.22636385138840265,0.4697938058093023,0.05814914400000001
24,Zero of Hats,@Zero87552330,1584896830.0,1241659689970077696,"I keep seeing this Kansas meme, citation please?  ",0.03577366501720658,0.11218056955968292,0.041282836
174,carson ,@carsoncapp,1584897000.0,1241659689970077696,"Replying to @those_rimshots The term Spanish Flu was coined by Spain, so in that case there is no problem. In this case there clearly is.  ",0.7163878295275646,0.3882036204761022,0.02003901
25,Zero of Hats,@Zero87552330,1584897006.0,1241659689970077696,"https://google.com/amp/s/amp.kansas.com/news/local/article200880539.html… this? Tracks with the France meme. How a killer flu spread from western Kansas to the worldGround Zero in one of the world’s deadliest influenza pandemics started quietly, inconspicuously.kansas.com ",0.6649364203769413,0.42379000327676136,0.04144791
263,LAKeith,@kietchayla,1584897602.0,1241659689970077696,Replying to @those_rimshots Saying korean bbq is racist now  ,0.4754784863665226,0.2517115706702247,0.93398505
175,marta,@marttayall,1584897983.0,1241659689970077696,"Replying to @those_rimshots I think so. Specially the ""spanish flu"" bc WASNT EVEN FROM SPAIN!!!! IT ORIGINATED IN KANSAS!  ",0.131327857167337,0.21259444452374252,0.06443241
176,Papapo,@heylookapotato,1584898723.0,1241659689970077696,"Replying to @those_rimshots As Asian, i don't think it's inherently racist. The problem is that the usage of it amplified the fear among the already racist. As soon as there were violence resulting the term should've changed. İf Spanish flu had similar effect then it too should be avoided  ",0.0443449574520792,0.5582238370408431,0.042694017
177,Squirrelz,@BradBobbely,1584899420.0,1241659689970077696,"Replying to @those_rimshots and @wcli1108 Spain themselves came out and said that it should not be called the Spanish Flu. If you make a mistake once why repeat it again. Also, the virus is already known as Coronavirus so there is no need to change the name of something that will only increase hate crimes...  ",0.609786160715909,0.7444674964244141,0.06559789999999999
234,Sigh,@EarlyYang,1584899449.0,1241659689970077696,"Well, i saw an article that said taiwan has a different version of the virus than that of china. The taiwan scientist said that only the US and australia has the taiwan version. If this is indeed true, then the virus didnt originate from a wuhan lab.  ",0.015974254380008216,0.5627827279801061,0.0142404
178,Namaste right here,@evildrummer,1584899554.0,1241659689970077696,"Replying to @those_rimshots I hit yea but only in that logic.  It isn't racist to call a virus out of china, chinese isn't racist, calling it such to blame random chinese people is. The only chinese with any blame are the CCP, and that's an important distinction  ",0.2099430841609328,0.5074253624580554,0.24978751
179,Mitchell Hilburn ,@RealMitcHilburn,1584901046.0,1241659689970077696,"Replying to @those_rimshots It’s a political tool just like calling it the Spanish Flu, when many reports point to its origins being in Germany and Kansas during WWI. Spain was neutral, so they became the scapegoat.  ",0.3488727837903314,0.4421187224966402,0.046734985
180,Rational Politics ,@RationalYang,1584901352.0,1241659689970077696,"Replying to @those_rimshots Spanish Flu got it’s name 100 yrs ago, and back then society wasn’t sensitive  and aware enough to not say such racist things. It’s like saying, since it was ok to have slaves before, it’s should be ok to have slaves now too.  ",0.06542574518749658,0.5700993214347528,0.0954271
181,PT  Ⓥ,@2Bcoach,1584901396.0,1241659689970077696,Replying to @those_rimshots Probably should not use 1918 as a time period to gauge what dictates racists terminology.  ,0.3770077376967071,0.3905863938362242,0.047330603
264,Jacqueline M Porter,@JacquelineMPor2,1584902293.0,1241659689970077696,Replying to @those_rimshots Covid 19 is a good name. No reason to call it Chinese virus.... unless you’re a racist and enjoy inciting more hate.  ,0.4608698026812926,0.5652934808770353,0.40520259999999997
182,Zaq Marquis ,@ZaqMarquis,1584902875.0,1241659689970077696,Replying to @those_rimshots The Spanish virus wasn't named due to how it began or spread. It got the nickname because Spanish News Networks were the first to follow the outbreak.  ,0.16740083838839984,0.26693801667765266,0.02011178
183,DavisLiuMD ,@davisliumd,1584904371.0,1241659689970077696,"Replying to @those_rimshots https://nbcnews.com/news/asian-america/reason-viruses-aren-t-named-after-locations-because-progress-experts-n1165366… - thanks @kimmythepooh @NBCNews Progress is why viruses aren't named after locations anymore, experts say""Just because certain terms have been used in the past doesn't make it appropriate now. We know that language evolves,"" an expert said.nbcnews.com ",0.19683939972765932,0.5313618470590736,0.06554739999999999
206,Eduardo,@Eddy626YangGang,1584904565.0,1241659689970077696,Replying to @those_rimshots People are just too sensitive and looking for reasons to shit on people.  ,0.9956374164327426,0.0689607965160041,0.44522494
207, YangIsTheFuture UBI,@Artists4Yang,1584905165.0,1241659689970077696,"Replying to @those_rimshots ""Spanish flu"" was inaccurate in its day. We should always strive for accuracy.

Asian Ams are getting the piss beaten out of them in the streets. Asia has a lot to offer the US in aid and resources. 

Suggestively pinning COVID on a country and ppl is not helping. It's racist.  ",0.03594142460286349,0.4523603120588578,0.8998822
208,nerwh,@Nerif20,1584905376.0,1241659689970077696,Replying to @those_rimshots They aren't comparable really.  ,0.031305649247636805,0.13893497341809974,0.12865679
209,Lost Heidi Scott Zachary Mayank ≥,@lsthart,1584905490.0,1241659689970077696,"Replying to @those_rimshots Yes. You know why it's call the Spanish Flu? Because they were the only country reporting truthfully on it.
And now because of the racists that pushed that name on it, we have to use that name so people know what we're talking about.  ",0.3258802500576515,0.4531111283437221,0.07874834
210,Aaron V. W.,@aaronvw1vet,1584905546.0,1241659689970077696,Replying to @those_rimshots The Spanish flu didn’t originate in Spain.  ,0.06894021050871774,0.228982916906242,0.10154883599999999
211,redefine the purpose of life,@pk94538,1584905615.0,1241659689970077696,"Replying to @those_rimshots In a society, each race is perceived differently. We can’t compare apples to oranges. Words also carry emotions and convey intentions. Examples: white ppl, black ppl, yellow ppl. They all refer to colors but obviously the last word is not neutral.  ",0.0017697877715906138,0.5309140811794023,0.024851065
212,Blazing Savannah      ,@Gladiosly,1584907980.0,1241659689970077696,Replying to @those_rimshots it is  ,0.2249583104923692,0.09537449269789494,0.06878680000000001
213,All Coles Are B*stards,@Crispin_Coles,1584908316.0,1241659689970077696,Replying to @those_rimshots The people who call it Chinese Virus are the same people who would've called it GRIDS instead of AIDS. Deplorable.  ,0.15249993834650066,0.21420392759736712,0.10958748
265,TLHStuff,@TLHStuff,1584909829.0,1241659689970077696,Replying to @those_rimshots Is the term in vacuum racist? Maybe not. Is Trumps push on it leading to hate crimes and Asian Americans literally being attacked in the streets over it? Yes.  ,0.44831876581148666,0.5519029871406679,0.12041371
214,Dustin  #BLM,@live2bstrong,1584910481.0,1241659689970077696,Replying to @those_rimshots It is but it’s a virus from a period and time when it wasn’t called out for being racist. Also it doesn’t call out one specific country. The issue with calling it China virus is not that we care to defend China but not to put Chinese and Asian Americans in harms way!  ,0.4873901574155714,0.661134936205351,0.18382032
