,username,userid,time,id,text,davidson,waseem,fountana
0,Donald J. Trump,@realDonaldTrump,31516201.0,1061168803218948096,"There is no reason for these massive, deadly and costly forest fires in California except that forest management is so poor. Billions of dollars are given each year, with so many lives lost, all because of gross mismanagement of the forests. Remedy now, or no more Fed payments!  ",0.0062597708592056454,0.5009227215854279,0.07319759599999999
84,Brick Wahl,@brickwahl1,1541818337.0,1061168803218948096,Replying to @realDonaldTrump The ones near Los Angeles are brush fires. There is no forestland to manage in the Santa Monica mountains. Just chaparral and grasslands. How can you not know this?  ,0.0017225219705896064,0.5591050508836994,0.040741358
85,eye2country,@eye2winner,1541818762.0,1061168803218948096,"Replying to @realDonaldTrump California is experiencing the worst fires in history and our President, instead of offering assistance, mocks the state's predicament?  An entire town has been burned down.  It is threatening LA.  Horrible fires to the north.  Fulfill your duties please - a state of emergency!  ",0.00027216989351760447,0.38141434693214,0.045707297
474,bayzill,@bayzill,1541819250.0,1061168803218948096,"Replying to @realDonaldTrump #climatechange-It’s dry as hell here. Lived in Nor Cal my whole life it wasn’t always like this. Whole neighborhoods, cities, towns burned to the ground. Drought  is causing this. I bet every NorCalifornian knows someone who lost there home to fire. Thank you #FirstResponders   ",0.7638443083189034,0.35948269057166204,0.028077496
1,Garrett Watts,@Garrett_Watts,1541819588.0,1061168803218948096,"Replying to @realDonaldTrump Unreal. In a state’s & people’s time of need... THIS is what you think to say. Communities burning to the ground, American corpses & countless wildlife lost in flames, & this is what you offer. You truly are the most graceless, piece of shit president this country has ever seen.  ",0.9965498222703544,0.5510168613505304,0.7209126
102,Magalina,@Magalina18,1541820542.0,1061168803218948096,Took the words right out of my mouth!  ,0.7080866507490702,0.09599952846869353,0.8974714
438,wehet snek,@museumofmusings,1541821198.0,1061168803218948096,"Replying to @realDonaldTrump Fuck you, you motherfucking shit eating cock sucking cum guzzling pig fucking piece of slimy shit garbage cunt bag. You are the actual anti christ. Your people's lives are being ruined and all you can do is tweet about money. Choke on your greed and rot in hell, bastard.  ",0.9999999999737534,0.5805585339048162,0.9598005
91,ejmack,@EllenMackay4,1541821229.0,1061168803218948096,When I lived in Santa Rosa Valley in the 60's the ranchers would do controlled burns . I think the APCD made them stop.  ,0.0184790953620434,0.3118814127732061,0.055858005
103,eye2country,@eye2winner,1541821849.0,1061168803218948096,"This qualifies as a natural disaster - the state is out of funds and needs help to fight the fire, more firemen from other states.  The President is responsible to organized a coordinated effort.  9 people have died.  We are ALL Americans!  ",0.2591701476611333,0.4565012897193358,0.05865264
86,Josh Morgerman,@iCyclone,1541823057.0,1061168803218948096,"Replying to @realDonaldTrump As you well know, Californians don't give a half crap what you think.  ",0.7621291173797768,0.3088426337384684,0.29976007
104,Magalina,@Magalina18,1541823220.0,1061168803218948096,"Might qualify as a natural disaster but not significant enough that the governor of CA can’t declare a state of emergency & request federal funds, which is how it is done 99.9% of the time. CA needs to prioritize funds & quit supporting all those illegals/sanctuary cities.  ",0.20390205990759025,0.6235964754840793,0.017755283
92,Brick Wahl,@brickwahl1,1541823398.0,1061168803218948096,"Btw, I never knew you lived up in Santa Rosa.  ",0.08996081516523613,0.1389028320145945,0.02607456
87,GordoFabulous,@GordoFabulous,1541824470.0,1061168803218948096,Perhaps he has a point?  ,0.3869991637912841,0.09722362860915967,0.04888199
88,Tomi T Ahonen,@tomiahonen,1541826733.0,1061168803218948096,"Replying to @realDonaldTrump MORON !!!!
There are no FORESTS on fire in California! They are BRUSH fires! People are dying! Americans!

Idiot! Why don't you aim your airplane at the DISASTER in the largest state of the Union? Rather than take Melania shopping in Paris? Act like a PRESIDENT.

You're an idiot!  ",0.15893879883403228,0.5949365161445473,0.89154315
90,TammyLynn,@tlc_prn,1541827271.0,1061168803218948096,Perfect answer !!!!!!  ,0.07281294158270149,0.061272995685924564,0.3447324
94,Gail Turley,@AuntInAZ,1541827514.0,1061168803218948096,"Replying to @realDonaldTrump What is WRONG with you? Ppl have died, lost homes, and this is your response? You know nothing about forest management, or the water situation, or the climate, and you refuse to learn. Then you attack the people who are trying to fight it. How can you be so callous and hateful?  ",0.02191260673994424,0.5268317234497704,0.12669078
96,VMiller,@Riley_B_Happy,1541828499.0,1061168803218948096,"Replying to @realDonaldTrump Wow. Just wow. I'm writing from a temporary residence like a displaced refugee b/c the fires took my home and everything we had. We we're lucky to get out with our lives. 
Just a reminder this is happening all over the planet.
1/2  ",0.016842248776656403,0.22020648525478267,0.046251073
109,gdelgado819,@gdelgado819,1541828868.0,1061168803218948096,Lil blue drip  ,0.26466391448015275,0.0667478898524527,0.012637961999999999
110,gdelgado819,@gdelgado819,1541829666.0,1061168803218948096,Drippidy drip.  ,0.19767137865877413,0.058151020410741425,0.03126506
97,Debbie MASK UP! JOE & KAMALA,@debilu2,1541829712.0,1061168803218948096,Glad you are safe and I'm sorry for your devastating loss.  I'm also sorry we have a so-called president who has no normal human qualities.  ,0.041646046552209263,0.3627233274737465,0.038107123
113,Christina,@christinasperos,1541830798.0,1061168803218948096,Debbie votes dem is the problem.  ,0.8492528721802793,0.17669342682267575,0.07451399
114,Madisonnp,@Madisonnp3,1541830920.0,1061168803218948096,How is SHE the problem!?  ,0.6987596288102464,0.1253555222885062,0.45549428
111,gdelgado819,@gdelgado819,1541832766.0,1061168803218948096,"There are walls already up,  no 1 is trying to ban religions, just keep the extremist out, healthcare needs to be repealed, shame on u, u socialist, go live in venuezuela lol  ",0.15076157781920818,0.707578210795861,0.104823135
98,JustSusan ,@TassajaraRd,1541834370.0,1061168803218948096,Replying to @realDonaldTrump Dear @GOP The US has no leader. In times of tragedy we need a president who brings people together & offers support. This #MangoMonster y’all prop up is on twitter threatening to pull fed assistance from California as we suffer horrific fire devastation. Enough !  #ImpeachTrump  ,0.8642644665641582,0.4754077195290989,0.07151796
99,OldAndGrinchy,@atliberalandold,1541834850.0,1061168803218948096,That’s an insult to mangoes .  ,0.4791341512965739,0.13607001455188572,0.40885827
122,JustSusan ,@TassajaraRd,1541835175.0,1061168803218948096,Sorry. But the color is accurate. Is #TangerineTyrant better ?  ,0.027978318051491254,0.21003008449769286,0.03158929
123,Teresa Greer,@terrible_tlg,1541835255.0,1061168803218948096,I'm a fan of #Orangeshitgibbon myself  ,0.08757831160096663,0.1340149730687157,0.053068135
100,Carlos Alejandro,@caphotography,1541835459.0,1061168803218948096,"Replying to @realDonaldTrump California paid about $369 billion in total federal tax -- or about $13 billion more than it received -- according to the Internal Revenue Service Data Book, 2014.  How much did you pay... grifter? #CaliforniaWildfires  ",0.010387758590386095,0.3973342316288065,0.017633416000000002
107,HowEasyWeForget ¸¸♫·¯·♪¸¸♩·¯·♬¸¸,@howeasyweforget,1541836702.0,1061168803218948096,"Replying to @realDonaldTrump Helping PR - too expensive.
CA fires - too expensive.
Fixing water in Flint (which was caused by Repub Gov) - too expensive.
Military parade, golf, sending troops to border for political stunt & promoting hatred, tax cuts for billionaires, hate rallies - NO PROBLEM!  ",0.003742382250388119,0.31101361788049675,0.019110106
116,Megan,@MeganNeal92,1541836827.0,1061168803218948096,"Replying to @realDonaldTrump My fiancé works on heavy equipment that they send up into our Forrest’s here in California when he goes up there he has seen many dead trees and brush, he has also asked y they don’t clear it. One of the guys told him the tree huggers are not allowing them to clear anything  ",0.031014336547503282,0.5381303613736135,0.068033025
2,Mia Farrow,@MiaFarrow,1541837539.0,1061168803218948096,"Replying to @realDonaldTrump What a ghastly, cruel mind you have. You are not fit to lead anything- least of all a nation filled with people you clearly loathe.  ",0.903160731003093,0.33311317006476715,0.44658533
475,Make America Smart Again...VOTE BLUE!,@LA2Vegas2LA,1541839180.0,1061168803218948096,"Replying to @realDonaldTrump Fine. If you are not going to help California as citizens die, then California will withhold payments to the Feds, resulting in a total collapse of many Red states. We are tired of supporting your base. #ChokeOnIt  ",0.20563024535207144,0.35819912775130514,0.0361702
3,Rebecca Rauber,@rebeccarauber,1541839585.0,1061168803218948096,"Replying to @realDonaldTrump You are a living, breathing monster. People have died. 

An entire town was destroyed by a natural disaster. 

I will work with every breath in my body to see you unseated...and jailed.

#FDT  ",0.055023364725227925,0.2559757465891685,0.048104204000000005
118,jody george-freitag,@mossgreenmerma1,1541840072.0,1061168803218948096,"Replying to @realDonaldTrump On behalf of all kind, concerned,emotionally present TRUE AMERICANS, I would like to give thanks to all of the Firefighters/Police/Frontline Respnders dealing with the wildfires and offer help and prayers to all those affected.  ",0.0007134581447094852,0.2709548748903185,0.013087113999999999
4,Mr. Pham,@ItsMrPham,1541840737.0,1061168803218948096,"Replying to @realDonaldTrump California pays over $405,851,295,000, in federal taxes, which is the most of any state.  Next is Texas coming in at $279,904,425,000.  Which means my state pays $125,946,870,000 more than any other state.  We don't need ""your"" money, you need ours.  You should just apologize.  ",0.8860708425640452,0.28750577427042545,0.015024121999999999
119,sam,@_SamD10_,1541841564.0,1061168803218948096,"This was the first kind tweet I saw on this post. I already have to see this horror every time I go outside, I don’t need to see those horrible tweet too. God bless you for spreading love and not hatred, some of us need that more than ever.  ",0.008741912394899123,0.17484570419912449,0.091318876
120,Barack Obama ____________________________Fan,@ThePresObama,1541841744.0,1061168803218948096,Replying to @realDonaldTrump Did you eat paint chips as a child?  ,0.5761077135906542,0.2401178068728401,0.014110926999999999
121,Jessica D Nelson,@JessicaDNelson1,1541842719.0,1061168803218948096,Evidently you ate plenty...and we the people are done with you and certainly don't need to hear anything from you  ,0.2441652114289344,0.2942805888098558,0.17804314
135,Michelle,@Gr8fulmommabear,1541842894.0,1061168803218948096,Clearly you indulged....... it’s not the real Obama  ,0.5044436802982464,0.3260666202036497,0.16603795
136,Jessica D Nelson,@JessicaDNelson1,1541842993.0,1061168803218948096,"Doesn't matter, it's the Kool aid mentality that I am done with  ",0.06524305437276935,0.09312379777442743,0.43917159999999994
124,Brad Wollack,@BradWollack,1541843044.0,1061168803218948096,"Replying to @realDonaldTrump Thank you for your care and concern. As a Los Angeleno, I can tell you all evacuees and the deceased appreciate your attention to petty fiscal matters at a time like this. As you know, that’s going to help the first responders risking their lives for others tremendously.  ",0.02394410331281633,0.3847598691284656,0.007628812
126,Kelly Morales,@RealKellyJones,1541843065.0,1061168803218948096,"Replying to @realDonaldTrump This is a direct coercive threat to the people of CA, who have no ability to remedy this tragedy & are in harms way from a fire that started on Federal land.

“I will leave you to burn, or else” should lead Twitter to #BanTrumpFromTwitter according to its policies. #HateSpeech  ",0.7437110688455439,0.3136664717425116,0.06054867
41,Anita Creamer,@AnitaCreamer,1541843230.0,1061168803218948096,"Replying to @realDonaldTrump Shame on you. Shame. People are dying. Other people are losing everything. An entire town is in ashes. And your only thought is to post ill-informed, threatening tweets. A real president would stand as one with victims in their hour of crisis. Shame on you.  ",0.3359947907636205,0.44791044522802825,0.11174901
5,HaroldBarnes,@bigbluegolfer,1541843384.0,1061168803218948096,"Replying to @realDonaldTrump Another threat Mr. Trump? So California doesn’t agree with your policies, so you bash us? Threaten us? Your supposed to unite this country not separate it? What is wrong with you? United we stand!!!! I voted for you, and I regret it! You are no way a team player!!! Lose the ego!  ",0.985994527669573,0.2718379101381911,0.7468191999999999
128,Jardon Maroon,@CaptainSparklez,1541844606.0,1061168803218948096,"Replying to @realDonaldTrump Imagine waking up in an evacuation shelter unsure if you’ve got a home to return to, only to see that your own president’s response is not one of well wishes or empathy, but a threat.  ",0.15068260380856482,0.2927582916921286,0.04939156
129,Butch Northwood,@Tamavista,1541844884.0,1061168803218948096,"Replying to @realDonaldTrump California pays $400 billion to the Feds-far more than any other State. People, animals, pets & stock are dying. Entire towns destroyed & acres wiped out in minutes & you make this about politics? Chilling & insensitive. I bet you'd help if a fire hit Rancho PV. Sad!  ",0.06997562983529187,0.4759186927602268,0.065579645
130,Christina Taft ,@XTinaTaft,1541845054.0,1061168803218948096,"My mother Victoria Taft is dead I think in #Paradise #fires Thursday. I'm devastated :(

They refuse to say 500-600 missing/reported unable to get out in news

I called 100s of times 12pm 4 10 hrs. NO REACUES. No firefighters rescued just cops checked 81/2 hrs later n all burnt  ",0.14657195913547624,0.3322869776832793,0.089742005
6,KathyRangel Resists,@KathyRangel729,1541845138.0,1061168803218948096,Replying to @realDonaldTrump   ,0.17570862623433728,0.03352323163434365,0.013172911499999999
42,Janet Spindle,@panseyeyes53,1541845652.0,1061168803218948096,"Replying to @realDonaldTrump Seriously...you lost my vote for 2020!  Not paying the men and women fighting these fires to save homes, lives, animals.... You are truly clueless.  My Brother-in-law is on the Woolsey Fire instead of your usual hurtful tone you might try being thoughtful and Presidential  ",0.030513407715462033,0.7623093687906898,0.025552928
131,Julie Solomon,@JulsSolomon,1541845789.0,1061168803218948096,"Replying to @realDonaldTrump This is beyond idioctic. It’s called a 7 year drought bc SoCal is a desert climate. And, this state has over 163,000 miles to manage. You can’t even properly manage a 55,000 sq foot white house, so sit down.  ",0.6806229537935852,0.3992183551975358,0.08038064
133,Kellie McSweeney,@KellieMcSweeney,1541845984.0,1061168803218948096,Replying to @realDonaldTrump I guess Californians have all forgotten that they have been threatening to leave the US.  No longer a state.  Now when things are bad they want us to forget all that. This is a horrible situation but I agree with forest control  ,0.04672952171866042,0.3496351636002396,0.039732464
138,Michael Green,@mikegreen661,1541846368.0,1061168803218948096,Replying to @realDonaldTrump Maybe California should cut off funding the rest of the country and stop paying the Federal government.  ,0.5526660891637223,0.2130173300170292,0.04129604
7,Steve Blum,@blumspew,1541846924.0,1061168803218948096,"Replying to @realDonaldTrump Out of curiosity, I looked up symptoms of a Psychopath this morning - here’s a partial list of a widely used diagnostic tool. I’d say you’re ticking off most of these this week. #8 and #9 especially today. Also, F-U. People are dying.  ",0.0003449403567293163,0.3299846308986329,0.0736378
141,Politically Savvy,@BirchTreeHill,1541847076.0,1061168803218948096,"Replying to @realDonaldTrump Souless, cruel, and stupid! When tragedy befalls you or your family, there will be no empathy. You sow only discord and vitriol. What species do you belong? Certainly you're not a caring human holding out a hand to your suffering fellow Americans.  ",0.2660228207224507,0.5310662531391768,0.27286315
140,Island Barbie ,@grandmabarbiep1,1541847435.0,1061168803218948096,I think we ALL should!!  ,0.31036428054096155,0.090704440844945,0.42396358
134,Tom Hull,@tmhull47,1541847795.0,1061168803218948096,"The winds are stronger than ever. I am an American veteran but I do not support this president. I do believe in science and climate change,and all the hurricanes and heat waves and floods are proof things are changing.  ",0.004423408218994261,0.4275665395505849,0.25818115
142,Jabzzy,@Jabzzy1,1541848019.0,1061168803218948096,Look up Romanoffs  ,0.4009513255092482,0.0402864739719094,0.026038147999999997
156,Politically Savvy,@BirchTreeHill,1541848701.0,1061168803218948096,"Do you mean the Russian, imperial family, the Romanovs or the poorly rated TV drama the Romanoffs?  ",0.009533762651608992,0.3280091168010973,0.038389787
8,Nice Like Snow White,@lsmbpants,1541849653.0,1061168803218948096,"Replying to @realDonaldTrump OMFG
YOU ARE THE F*CKNG WORST EXCUSE OF A HUMAN BEING LITERALLY THE WORLD'S EVER SEEN AND YOU'VE STOLEN A PRESIDENCY AND YOUR COLDNESS IS RUNNING THROUGH THE VEINS OF THIS COUNTRY. HOW FUCKING DARE YOU BLAME THIS ON US.  ",0.7923888009172184,0.3513541811871191,0.91654295
143,Michael A. Stusser,@MichaelStusser,1541851123.0,1061168803218948096,Replying to @realDonaldTrump #climatechange #CaliforniaWildfires  ,0.034711985746492736,0.17419716162068405,0.012385703999999999
43,Danny Deraney or The King of Jingling,@DannyDeraney,1541851238.0,1061168803218948096,"Replying to @realDonaldTrump People are losing their homes, their possessions, their lives, their animals. 

Here you are, threatening them as they lose everything. You are the President of shit.  ",0.9918265469757912,0.4982117976088621,0.9022209000000001
9,Mike Scully,@scullymike,1541851624.0,1061168803218948096,"Replying to @realDonaldTrump After we find out if our home is still standing, I'm flying to Washington to set your hair on fire, you compassionless piece of shit  ",0.9952224388064816,0.16688262453365627,0.8868719
144,Babs Dub,@brwexler,1541851632.0,1061168803218948096,"Replying to @realDonaldTrump Are you kidding me? Our fires are  due to weather conditions. Our forests are not mismanaged. Why don’t you come and see for yourself, or are you afraid of the California Democrats? How about being a leader and lead? #Woolseyfires #CaliforniaWildfires #ClimateChangeIsReal  ",0.00020914819746913215,0.5538017919265443,0.037736826
151,courtneyof bebbanburg,@LA_fangirl1,1541853206.0,1061168803218948096,"Replying to @realDonaldTrump “Forest fires.” 

In Southern California. GIF ",0.3310468198205153,0.11846054945867,0.011632577
152,call me v ,@senoritav76,1541853378.0,1061168803218948096,Right?! He literally has ZERO clue as to what he’s talking about here.  ,0.5121144386426537,0.24692569700414616,0.76051664
153,jillian,@jillianbutlerrr,1541853645.0,1061168803218948096,Replying to @realDonaldTrump   ,0.17570862623433728,0.03352323163434365,0.013172911499999999
162,Cynthia Harkness,@HarknessCynthia,1541854013.0,1061168803218948096,He has zero knowledge about anything he talks about. He makes it up.  ,0.06946760385901858,0.1700660757634294,0.22029899999999997
158,Adam K,@adamk1121,1541854468.0,1061168803218948096,Replying to @realDonaldTrump Troubling statement here DT  ,0.36724198908171707,0.06451338882463055,0.047876034000000005
44,Joe Bereta,@joebereta,1541855789.0,1061168803218948096,"Replying to @realDonaldTrump People will celebrate when you’re gone. History will ridicule you.
You are truly a stain.  ",0.13143412385890338,0.22399397981899535,0.05620199
10,Tmmy L33,@MrTommyLand,1541856178.0,1061168803218948096,Replying to @realDonaldTrump Can you be anymore insensitive you fucking moron  ,0.98710656407186,0.1782062723105943,0.9160832
160,Billie Cudney,@bearypatch,1541856949.0,1061168803218948096,Replying to @realDonaldTrump   ,0.17570862623433728,0.03352323163434365,0.013172911499999999
45,Alyssa Milano,@Alyssa_Milano,1541857380.0,1061168803218948096,"Replying to @realDonaldTrump People lost everything. 250k people are displaced, their beloved pets lost. And firefighters are risking their lives. And this is all you got? THIS is it from you? Shame! Shame! Shame!  ",0.8789073871338664,0.3023079868715618,0.9386718000000001
161,Kelly D,@Kellydora,1541858080.0,1061168803218948096,Like minded  ,0.3439938764020713,0.05200613616566789,0.068379976
46,Carol Sabik-Jaffe,@CarolSabikJaffe,1541858197.0,1061168803218948096,Replying to @realDonaldTrump Oh Donnie... a real President.  ,0.3035282193798367,0.1925642637907652,0.047845885
60,Barbara in SoCal ,@HairyKnees72,1541858209.0,1061168803218948096,"Replying to @realDonaldTrump WTF!? Last time I checked Malibu is not a forest. It's called weather. Drought, 5% humidity, erratic winds. Sorry we haven't learned to control the weather yet. I know you hate CA b/c we soundly rejected you. Get your facts straight before you open your Twitter yap #SAD #CALFIRES  ",0.4688488113783311,0.5231536396186438,0.018232888
47,paul rudd,@philsadelphia,1541858223.0,1061168803218948096,Replying to @realDonaldTrump   ,0.17570862623433728,0.03352323163434365,0.013172911499999999
165,Pamela Anderson,@pamfoundation,1541858387.0,1061168803218948096,"Replying to @realDonaldTrump It’s hard to bite your tongue on this one - A completely selfish idiotic fool who must work for the devil - narcissist perv who has no regard for anything but money and fame. I officially déteste this toxic 
planet hater -gun lover  - sickening   ",0.033202028255218716,0.4729512408599573,0.896386
167,Aaron Wolf,@TheAaronWolf,1541858449.0,1061168803218948096,"Replying to @realDonaldTrump My Grandfather, Rabbi Alfred Wolf, escaped Nazi Germany, and built #CampHessKramer in 1950. A true leader. First Jewish Summer camp west of the Mississippi, now fire torn. I’m so sad. But fires won’t stop his dream of a bully free land. His America is my America. @RestoringMovie Wilshire Blvd Temple and 9 others ",0.001981358810931139,0.7415218553440778,0.01911219
48,John Panzer,@jpanzer,1541858821.0,1061168803218948096,"Replying to @realDonaldTrump I've just reported this tweet for ""targeted harrassment"" and suggest others do the same.  He is using Twitter and his office to threaten and harrass victims of wildfires because he wants to get his followers to see them as enemies.  ",0.15502003530135125,0.1573257080935478,0.01922634
169,katherine mendez,@kattspaws64,1541859035.0,1061168803218948096,"Replying to @realDonaldTrump People need help now here in CA. Please don't punish the ""people"" at this time because of crooked politicians.  I am republican and I voted for you. But I can't feel good about this tweet you made. It feels like you don't care. So many are suffering. Please have compassion.  ",0.08326667125683034,0.31121838660066875,0.036428302999999995
57,DianaTash,@DianaTashSings,1541859089.0,1061168803218948096,Replying to @realDonaldTrump   ,0.17570862623433728,0.03352323163434365,0.013172911499999999
170,Joe Cash,@JoegCash,1541859534.0,1061168803218948096,Trust your feelings. He does not care.  ,0.4913234948979391,0.11211054572260944,0.13226138
448,norvina,@norvina,1541859749.0,1061168803218948096,Replying to @realDonaldTrump Great time to lecture an entire state. Sorry firefighters can’t get you that “Remedy PDF” ASAP they’re a little tied up at the moment. You’re the parent that scolds their kid for falling down  Btw there’s always a reason for everything - see Newton’s Laws  ,0.2233128213764364,0.4556290374244586,0.06285399
173,Mark,@Mark_UK73,1541859848.0,1061168803218948096,"Replying to @realDonaldTrump The forests that are on fire are 98% owned and managed by the Federal Government (not CA). You cut the funding to these agencies, but it's good that you finally owned up to YOUR gross mismanagement of these forests.  ",0.167168705567473,0.2868319718450861,0.013828294
449,mimi,@mimiluvmakeup,1541859968.0,1061168803218948096,"we can't keep on fighting a disease without knowing the cause. Otherwise the disease will keep on coming back. Knowing the root help fixing the problem, Yes his tweets came at the wrong time but they aren't wrong either.  ",0.3948451898162583,0.19654502361471807,0.06514455400000001
178,CINDI ABBOTT,@cindi_abbott,1541860059.0,1061168803218948096,They wont find a heart when they do his autopsy  ,0.34163632866039834,0.1641134600935163,0.08438606
175,Heather Anne Campbell,@heathercampbell,1541860821.0,1061168803218948096,Replying to @realDonaldTrump Strange to attack the Federal Parks as a problem with state management. This is a bit like screaming in Trump Tower that the landlord isn’t doing his job.  ,0.44578365983390106,0.3025635871737344,0.058963522000000004
179,sherylee,@sherylwelch57,1541861017.0,1061168803218948096,"When there's a tweet you disagree with, you loose your minds  ",0.4835087843064189,0.07239730163510193,0.09056857
