,username,userid,time,id,text,davidson,waseem,fountana
0,Jose Nieves ,@those_rimshots,31516201.0,1241659689970077696,"Honest question:

If saying “Chinese virus” is considered racist, is saying the Spanish Flu also racist? Yes55.6%No44.4%1,832 votes·Final results ",0.14273517001841454,0.4245402323018581,0.01296607
1,Jose Nieves ,@those_rimshots,1584850029.0,1241659689970077696,Replying to @those_rimshots Comment why or why not. I want to hear your opinions.  ,0.10455073623354087,0.31279112577026474,0.011959555
75,sara ,@sweetsnpeaches,1584850072.0,1241659689970077696,Replying to @those_rimshots @bacobinkle  ,0.1343006036379446,0.10869174638932988,0.075761
225,ji,@jqsonleong,1584850312.0,1241659689970077696,"Replying to @those_rimshots coming from a chinese american, i wouldn’t even call “chinese virus” racist, it’s reckless at worst. but it is accurate. that being said i still don’t like it’s said as such  ",0.2495623790451975,0.5600625058992368,0.093196735
76,MrJermson,@MJermson,1584850373.0,1241659689970077696,Replying to @those_rimshots When the whole world called it Coruna virus or Covid19 ..  ,0.16098010326087878,0.4299220093212501,0.050277967
2,Tamz ,@Kevtamz,1584850750.0,1241659689970077696,Replying to @those_rimshots I feel like if he said Wuhan virus it would be more acceptable as that's the place of origin supposedly. Calling it the Chinese virus in a time of crisis when everyone's emotion is already running high places Asian Americans at risk of racism.  ,0.17901108797673315,0.703020066275912,0.23495603
4,Douglas ,@dougsthename_sg,1584851020.0,1241659689970077696,"Replying to @those_rimshots At the time, the political climate and political correctness was much different and much less PC. The fact that the virus has other mainstream names (Coronavirus/Covid19), means going out of your way to make it about race referring to it as the “Chinese Virus” is racist.  ",0.012516727090662058,0.5418582812821624,0.64178497
77,Hector,@hieniscool,1584851103.0,1241659689970077696,"Replying to @those_rimshots With the condition that “Chinese virus” is racist, then yea “Spanish flu” would also be racist. However, I don’t think either are inherently racist. But that also doesn’t mean they aren’t dangerous and can’t incite violence.  ",0.16519578943640445,0.6078631946348252,0.0769713
6,Will Weyting,@WWeyting,1584851916.0,1241659689970077696,"Replying to @those_rimshots The last pandemic was in 2009. It was the swine flu H1N1 pandemic and the virus came from Veracruz, Mexico. What was the pandemic called? How does the COVID-19 pandemic compare to the last pandemic?There are some key differences between the 2009 swine flu and COVID-19, and the response to each of them.livescience.com ",0.04165304955349703,0.2967544200909278,0.021393022
238,Gene Lasecki,@gene_lasecki,1584853043.0,1241659689970077696,"Replying to @those_rimshots It being the Swine flu from Kansas Anything but is the inbred blame game 

And Yes Extremely Racist  ",0.18544642233278294,0.5207026350797019,0.7815658000000001
239,Jake Charles ,@thejakecharles,1584853528.0,1241659689970077696,"Replying to @those_rimshots It isn’t racist, it is factual. Although it is reckless to use it at a time like this.  ",0.9061464059000638,0.2328593322723647,0.036869477000000005
79,cereallytho ,@cereallytho,1584853865.0,1241659689970077696,"Replying to @those_rimshots cdc calls it 1918 pandemic. Coronavirus/covid was & is widely used around the world. Only the dumbass president started pushing chinese virus when cov was already widely used, giving bigots a term to rally behind. B4, they just jumped us w chink,now its a weaponized closet slur  ",0.007818513895143334,0.6742805374989085,0.09241354
9,OPG4711,@opg4711,1584854086.0,1241659689970077696,Replying to @those_rimshots Spanish Flu refers to an historic event of 100+ years ago. Calling it something else in 2020 would create confusion. But it wouldn’t be used today if it were a current pandemic.  ,0.05700397167222531,0.3501529668762865,0.026465562999999998
240,CrystalS ,@groundx,1584854413.0,1241659689970077696,"Replying to @those_rimshots Spanish newspapers first reported the flu hence the name when the world lacked more precise, scientific terms. We now have Ebola, AIDS, SARS, etc. One adds no value to the discussion by not referring to it by the name the health authorities are using: #coronavirus #Covid_19  ",0.08562127123227865,0.5404878472149625,0.04601486
7,Chris,@ckking701,1584854653.0,1241659689970077696,"It wasn't called no Veracruz Flu or Mexican Flu, I'll let you know that.  ",0.1763047348530572,0.2442422268250936,0.10905661
11,Sarah,@smoothieDub,1584854703.0,1241659689970077696,Replying to @those_rimshots No it’s not.  If it came from Ireland it would be called the Irish Virus. So what.  If it’s said in a mean way by being a smartass then no that’s not nice but calling it after the country of origin is no big deal.  ,0.6594803951499227,0.7160152028290093,0.37381208
241,Chris,@ckking701,1584854704.0,1241659689970077696,"Replying to @those_rimshots The Spanish flu originated in Kansas. Additionally, it reflects a time in which it was socially acceptable to use racial slurs. Do you really want to revert to a time like that?  ",0.051833010252245994,0.3301440679710754,0.041065372999999995
83,Sarah,@smoothieDub,1584854844.0,1241659689970077696,"Replying to @those_rimshots Spanish Flu, German measles.  That’s just the way it goes.  It came from those countries.  Same would go for Ireland.  Simple.  ",0.5831118612322547,0.3677082874597378,0.019329395
84,tbri001,@tbri001,1584854863.0,1241659689970077696,"Replying to @those_rimshots Not really, as it wasn't called Spanish flu because of point of origin. It had more to do with Spain's neutrality during WWI. They had a freer press and were able to report more honestly.  ",0.005864454302333536,0.3676594452828706,0.017903923999999998
88,KrazyLion  ,@lion_krazy,1584856122.0,1241659689970077696,Replying to @those_rimshots Yes.  For one the Spanish Flu started in the US.  President Wilson kept it quiet until it broke out in Spain and deflected the name since they called it out.  Calling this by ethnic group only illicit division for small minded people to justify their hatred.  ,0.6427111697499056,0.5214477581696276,0.07099686
13,Jonathan Michael Di Carlo,@jonathandicarlo,1584856850.0,1241659689970077696,Replying to @those_rimshots The Spanish flu started in France.  ,0.18803820303249008,0.17436549265644227,0.0836128
89,CaraMel,@autumnswift2118,1584857096.0,1241659689970077696,"Replying to @those_rimshots Wasn’t around then, but were Spaniards being verbally abused or physically assaulted worldwide from 1918 - 1920?  ",0.2387923714243029,0.2812139113546393,0.0507387
90,C King,@CKing98,1584857610.0,1241659689970077696,Replying to @those_rimshots It has a name the medical community adopted worldwide from the beginning so imo changing it to refer to a country can only be to constantly put the idea in people's minds that the virus should be blamed on a specific group of people when they just happened to be the first victims  ,0.030864801915449706,0.5687758419355677,0.054732453
15,Yang Trek ,@apodivore,1584857842.0,1241659689970077696,"Replying to @those_rimshots Both terms are pure propaganda designed to create an enemy for political purposes.  Orwell in action. It just so happens that racism is a more potent tool of despots nowadays than nationalism, but why not both!  ",0.0008677516377760059,0.6827293753988499,0.45278567
91,zimpzamp,@ZimpZamp,1584858044.0,1241659689970077696,"Replying to @those_rimshots It all matters on the intent. I think people should mind their business if some of them wants to call it ChinaVirus. 

Although, that might provoke real racist people. There is a section of society that will always cause harm to others. Law is there to take care of them.  ",0.9911627766215256,0.6793629435518216,0.18745576
92,JakeTheHuman  #YangGang4Life,@JakeTheHuman28,1584858181.0,1241659689970077696,Replying to @those_rimshots It gets grandfathered in. Racism and ethnonationalism were more acceptable during the Spanish flu. If it happened in 2020 we would call it something different.  ,0.08562193755735323,0.30198295285340154,0.051592324
5,zimpzamp,@ZimpZamp,1584858239.0,1241659689970077696,"I think Chinese government is responsible for this, mostly. You don't get to decide what is racist and what's not. Law does.

But I have a propsition for you, disagreeing with me is Racist and act of a Xenophobe person. Good day.  ",0.433005363514151,0.502724795965014,0.04154984
93,Naireip ,@naireip1,1584858288.0,1241659689970077696,"Replying to @those_rimshots That's not the point. The point is, it's a politically-not racially-motivated name with racial consequence.  ",0.07930370997476645,0.1797126191844901,0.37000626
94,chirpchirpful,@robinmmuller,1584858629.0,1241659689970077696,Replying to @those_rimshots No one cares about where the Chinese virus came from. Just Donald Trump and his people.  ,0.9161251752120744,0.3367727005443265,0.16161188
17,Humans for YANG,@MarcTheLogical,1584859352.0,1241659689970077696,Replying to @those_rimshots Funny enough the Spanish flu originated in China as well but during WWI Spain wasn't on a media lock down so they were the only ones reporting on it.  ,0.02622681257351108,0.3541368514115957,0.069415785
228,Sara ,@SaraEnki,1584859606.0,1241659689970077696,Spain and Mexico are 2 different countries  ,0.08983730678430242,0.12072607840696553,0.029608015
8,KrazyLion  ,@lion_krazy,1584859609.0,1241659689970077696,"Word choice do mattter.  It creates a negative connotation. There are people incapable of rational thinking and, in this situation, associate the cause to Asian people because they laced mental distinctions; thus, incites hatred against a demographic.  ",0.004254628978938004,0.3510589619601695,0.28465688
19,Tamales 4 Some ,@Rage_CrimsnRd,1584859968.0,1241659689970077696,Replying to @those_rimshots Yes. The Spanish flu didn’t originate in Spain. The influenza was named after the King of Spain once  rumors  went around Europe that he contracted the flu. It was a strategic WW1 tactic to boost “morale” after countries kept the flu hidden for months. They did it again w/ COVID.  ,0.0052228899669873,0.4454716794500857,0.054639815999999994
95,Missy,@SmithMissy,1584860198.0,1241659689970077696,"Replying to @those_rimshots Both Unacceptable. Even so, like the Spanish Flu, people have adopted the ""Chinese Virus"" name because of our incompetent leader calling it out as such and his lack of ability to even take an ounce of responsibility for how he handles a crisis that he ignored and knew was coming.  ",0.5076726302172878,0.5831863252876519,0.28994942
26,Cindy,@PW_clashofclans,1584860253.0,1241659689970077696,"Replying to @those_rimshots Seriously, USA. No one else in the entire world calls it that. It's the coronavirus or COVID-19. Focus on what to do about it, how to help one another and don't dwell on these distractions created by Trump.   ",0.009543609110063087,0.4067610306960432,0.013923797
28,mnca,@pinatacupcakes,1584860599.0,1241659689970077696,"Replying to @those_rimshots Racism is about intent, power, and damage. “Chinese virus” is not meant to inform because literally everyone calls it coronavirus. There’s something else going on.  ",0.01831624075280256,0.30002571665550304,0.4799492
30,Beespoken ,@Bee_the_change_,1584860684.0,1241659689970077696,"Replying to @those_rimshots Spanish Flu didn’t even come from Spain so yeah, pretty dumb. 

Chinese virus is at least accurate, but also very dangerous considering how it’s being used. It’s out of spite.

Get mad at their government, not the Chinese people. What fault do they have in any of this? Horrible  ",0.5816191813826976,0.3873709559276585,0.54072654
31,We’re all Jimmy Sham,@dm6891,1584860761.0,1241659689970077696,"maybe you'd support this initiative ? Quote TweetSimon Shen@simonshen_glos · Mar 22, 2020... soil and the virus was brought to Wuhan via infected US players participating at  the Military World Games 2019. We demand US government to disclose the health condition and recent medical status report of all US participants of the Games, especially of those 5...Show this thread ",0.00016386800994288038,0.5926504424529377,0.020215586
242,Adam ,@indub14,1584860992.0,1241659689970077696,"Replying to @those_rimshots Have you seen the videos of Chinese people getting assaulted? Let's call the virus by it's scientific name AND blame the Chinese GOVERNMENT for mishandling this...

Everyone needs to stop playing politics with this shit.  ",0.9988494646241995,0.3565385653863996,0.7436897
96,Shael Riley ,@ShaelRiley,1584861139.0,1241659689970077696,"Replying to @those_rimshots I went ahead and checked ""yes,"" because I couldn't think of a justification for how it wasn't.  ",0.05546629003132733,0.14685036921321615,0.0608689
229,Steve ,@stevemendez1,1584861282.0,1241659689970077696,"It’s mostly because corona, the beer, is made in Mexico fyi :)  ",0.03783434531017988,0.08719131965673993,0.026478365
97,Kendra for Humanity First & UBI#BLM,@LoveMeSomeYang,1584861829.0,1241659689970077696,Replying to @those_rimshots I don't necessarily know the answer but I feel like the Spanish Flu being 100 years ago and NOW we call it the Spanish Flu is very different from this situation where it's something that just came about this year you know? Like I doubt they called it the Spanish Flu in 1918  ,0.7544576637877755,0.4599176394899772,0.07461222
18,thetroybarnes,@thetroybarnes1,1584861906.0,1241659689970077696,actually in Kansas  ,0.11857962490765928,0.18665697342463025,0.023345625
99,Mericans Keep Winning,@OzRaptor,1584862006.0,1241659689970077696,"Replying to @those_rimshots Virus has negative connotations. Also, contextually, Trump specifically chose the term to incite: xenophobia, hate, blame & violence to distract from his incompetence  ",0.0610944321029503,0.31981886551603034,0.63509107
98,Kendra for Humanity First & UBI#BLM,@LoveMeSomeYang,1584862087.0,1241659689970077696,"And I say ""I doubt"" because I don't know. They could have called it the Spanish Flu in 1918 for all I know lol. Which I could research that but.. don't really feel like reading about another pandemic lol  ",0.3104034710885273,0.3313328030051118,0.03642691
32," Bob Wants Peace, Low IQ Jr ",@JayMansion1,1584862134.0,1241659689970077696,Replying to @those_rimshots Viruses don't have nationalities.  ,0.08437811700489001,0.18588035597459665,0.6614509
243,Kaiser Wilhelm II ➐,@KaiserWilheImII,1584862360.0,1241659689970077696,"Replying to @those_rimshots Saying Chinese Virus isn’t racist ok my book. The virus originated in china. To me it’s like saying that ‘I’m going to eat Chinese food’, or even ‘Chinese food tastes like shit’. It’s not racist. Unless you use it as an excuse to be a dick.  ",0.9737477621330098,0.4851278119968234,0.7499864
100,Lola C  ,@lolacuk,1584862388.0,1241659689970077696,Replying to @those_rimshots I would be up for renaming all old pandemics known by geographic names to more scientific names.  ,0.027508976077684627,0.1629615183821332,0.022778375
250,Dave Alton,@RaughKee,1584862568.0,1241659689970077696,Replying to @those_rimshots It was created in China by abominable food practices #EndWetMarkets that have now caused two outbreaks in the past 20 years and will cause more. The CCP then covered it up and is now issuing propaganda to blame us.  ,0.05533030950832071,0.6387933177118422,0.025692157
101,Kevin | CRO @inside,@kcurryl2g,1584862592.0,1241659689970077696,Replying to @those_rimshots It’s not racist. It’s antagonizing China and they are not going to take it well. Right now our defense systems are vulnerable. This could be really really bad.  ,0.009566331311250046,0.3062848059907438,0.27581453
102,Steven ,@Leo53330349,1584862616.0,1241659689970077696,Replying to @those_rimshots I only think it's racist when the intent of using the term is hateful  ,0.7927232776368264,0.3165348003191207,0.85331947
35,Sigh,@EarlyYang,1584862716.0,1241659689970077696,"Replying to @those_rimshots When the virus already has two names, covid-19 and coronavirus, and trump tries to push for a third that harms a group of citizens, its fuckin racist! Btw, the spanish flu originated in kansas usa!  ",0.8248591399934501,0.5793243732726542,0.67342275
103,Josh Bray (He/Him),@JoshBrayKC,1584862760.0,1241659689970077696,Replying to @those_rimshots I feel like our President wants to create a rift and divide between all races to make white nationalists feel more superior. Republicans are essentially America's wumao's.  ,0.020426082425480475,0.3393762728692095,0.44650552
14,Juliehere4YANG,@Juliehere4YANG,1584862780.0,1241659689970077696,"Some say Kansas, some say China, some say France  ",0.5732078201780675,0.0891016028347629,0.050337832
104,Vinnie ,@Vinnie37540118,1584862807.0,1241659689970077696,Replying to @those_rimshots I prefer it was called Wuhan or corona virus but I prefer that we stop talking about it and focus on more unifying issues  ,0.6134823055707306,0.3590334378256822,0.019317148
39,張三爺 (Mike) ,@Mike_DWNY,1584863041.0,1241659689970077696,"Replying to @those_rimshots I think the better question is will calling COVID19 the Chinese Virus cost harm to AsnAmericans, especially during this challenging time. 45 never bothered address this already happened issue. There are lots of low information ppl who will see an AsnAm n link them as the cause.  ",0.35737819022261136,0.3809135973915799,0.20045090000000002
105,Ink Fairy,@CDranias,1584863235.0,1241659689970077696,Replying to @those_rimshots Would you agree with me if I said it’s used to benefit both trump and xi? Both are eager to find someone else to scapegoat in this crisis and strengthen their leadership position domestically.  ,0.015957854925998653,0.348060206525586,0.021329667000000004
108,John Lee Bingham/,@JohnLeeBingham1,1584863326.0,1241659689970077696,"Replying to @those_rimshots Chinese is one from China...
A Spaniard is one from Spain...
I have never heard anyone refer to is as ""Spaniard Flu""... 
I have never heard Trump or his pals say ""China Flu"" therefore. He is making this personal. Period.  ",0.19049541828445546,0.6966967176490327,0.068950154
251,Eddie Chu ,@eddiechu888,1584863365.0,1241659689970077696,"Replying to @those_rimshots It’s only racist if it encourages anti-Spaniard racism, like “Fucking Spanish!”, yelling “Spanish virus!” at people who look Spanish, beating up Spanish people, etc. Quote TweetEddie Chu @eddiechu888 · Mar 22, 2020Thread: racism towards Asians.

You can’t stop being Asian.

You can stop calling it the “Chinese virus” because it’s racist af.

If Trump wants to blame the Chinese gov he should say “I blame the Chinese gov, and not my own incompetency, because of X, Y, and Z.”

But he can’t. t.co/GC56tl5iO6Show this thread ",0.2942319217988054,0.5935625670623038,0.34737435
230,Sigh,@EarlyYang,1584863375.0,1241659689970077696,"Dont be so sure, dummy. There are articles that say the coronavirus occurred in the US and italy before in china. The same way the spanish flu originated in kansas usa but was first announced in spain.  ",0.05844949126274704,0.5313245115104127,0.03044038
20,dawn marie ,@gustergrl03,1584863626.0,1241659689970077696,Thank you. It's inherently different.  ,0.05527674995665767,0.03807472241213985,0.01908821
37,Lola C  ,@lolacuk,1584863769.0,1241659689970077696,"Nay, this sort of conspiracy theory finger-pointing is counter productive. @Bee_the_change_ has the better attitude. Change the problematic policies, because stereotyping won't solve the problem & many innocent bystanders get hurt.  ",0.43611241279308544,0.25437273449909475,0.051332157
252,Dr. Bourgeoisie feminist ,@asneyers1,1584863798.0,1241659689970077696,Replying to @those_rimshots Spanish flu came from Kansas so more misinformation than racism  ,0.15773732123645293,0.35664153712421404,0.28971959999999997
109,R.I. “Wear YOUR Mask” Porter ,@richardiporter,1584864033.0,1241659689970077696,"Replying to @those_rimshots The “Spanish Flu” was named in a time of more accepted racism. 

Also it originated in Kansas.  ",0.07188236653941325,0.4517349784822118,0.029841263
10,Lola C  ,@lolacuk,1584864067.0,1241659689970077696,I think it still can be changed. People can still learn. Itay take getting used to for older folks. Young ones certainly will have no problem as they don't have prior knowledge. The best time change was back then. The next best time to change is now.  ,0.029457578790611887,0.3062043639619628,0.01623322
226,Wanda,@wandawhatsup,1584864268.0,1241659689970077696,"Replying to @those_rimshots @realDonaldTrump had a scripted speech with corona virus crossed out to say Chinese. Spanish flu is not from Spain. Swine flu came from US. Do we call it US pig virus? You tell me? Racist, reckless, both?  ",0.35160820572965945,0.5252568708910013,0.82008076
110,Paula Stone ,@pms_365,1584864399.0,1241659689970077696,"Replying to @those_rimshots Its a pandemic...the whole world is dealing with it. With that being said, is any one else calling it that?  ",0.578324408794462,0.3472268015976281,0.055595372000000004
227,乐呵呵,@dJNqpPUL9ghmOXn,1584864464.0,1241659689970077696,yes，you can say US pig virus  cuz of free speech  ,0.24230700966199745,0.2192942725779613,0.87466
41,Jarrod Thweatt ≥,@AhsokaAshlaTano,1584864592.0,1241659689970077696,"Replying to @those_rimshots They are both racist.

Spanish flu is technically called the influenza pandemic of 1918 and didnt originate in Spain is only when/where the allies picked up on it so they decided to called it that to point it out 

Calling the Coronavirus the Chinese/Wuhan Virus is the same thing  ",0.02957747163769258,0.5263622030618912,0.14970963
111,Christian Martin ,@ChristianM_28,1584864673.0,1241659689970077696,Replying to @those_rimshots Yes  ,0.21089156103370899,0.053827063530062634,0.049990125
43,𝓕𝓲𝓽𝓷𝓮𝓼𝓼 𝓩𝓪𝓭𝓭𝔂 ,@zantorien19,1584864691.0,1241659689970077696,Replying to @those_rimshots Spanish flu didn't originate in Spain. I think calling this the Wuhan Virus or China virus AFTER it is over is completely fine. Also could just stay COVID-19. At this time it is very dangerous to label it that way.  ,0.057197357502658336,0.41274492439888777,0.026564961
112,Annie Qian,@qian_annie,1584864848.0,1241659689970077696,Replying to @those_rimshots In 2015 WHO  set a rule DO NOT name a  infectious virus with A country or city’s Name .   That is why call COVID 19 .  Not Chinese Or Wuhan Virus   ,0.4753095133259278,0.5997496775683151,0.022452002000000002
42,𝓕𝓲𝓽𝓷𝓮𝓼𝓼 𝓩𝓪𝓭𝓭𝔂 ,@zantorien19,1584864883.0,1241659689970077696,I find it hard to call the Spanish flu racist. Since they are the country that brought it to the attention of the world. So the should get some credit for that.  ,0.7915258473721272,0.3988327967061199,0.08097789
113,Ben Kendrick ,@FungiwithBengi,1584864895.0,1241659689970077696,"Replying to @those_rimshots I feel like it was fine when it was called wuhan virus, because ebola, west nile, spanish flu, dengue fever, etc. but then ""certain types"" rebranded it as the ""chinese virus"" with negative intention, and that was racist.
I voted no, but some people are for sure making it yes.  ",0.0240164692025002,0.39698353576302575,0.045160957
114,Michael J Jackson ,@mjjdota,1584864981.0,1241659689970077696,Replying to @those_rimshots Spanish Flu was racist at the time but now I think it would be rare for someone to say it with racist intent  ,0.7778866185175622,0.29224172110316793,0.051903464
115,Dennis Hansen ,@dennizor,1584865040.0,1241659689970077696,"Replying to @those_rimshots The Spanish flu needed some additional word or it would have just been called the flu, which isn’t unique. Coronavirus is already unique. Adding Chinese to it was never necessary.  ",0.009448745266855551,0.32830554543343665,0.05244591
38,YangGangForLife ,@nowayjo81621943,1584865059.0,1241659689970077696,Thank you  ,0.3062409768739542,0.02813740842720697,0.015947407
116,John Reads Tweets ,@ChubberGuard,1584865140.0,1241659689970077696,"Replying to @those_rimshots This was a common rebuttal among people who want to keep calling it the China Virus. I'd point out, the origin of the 1918 flu was hard to determine, but initially it was thought that it came from Kansas. The reason it was called the Spanish Flu was because of media. 1/2  ",0.4265273494583517,0.6313997859739545,0.035047006
118,yang2024,@vote4yang,1584865174.0,1241659689970077696,"Replying to @those_rimshots Don’t fall for his trick! He’s inciting hate amongst different groups so that one side supports him, which helps him and distract people’s attention from his lack of leadership and qualifications for the office.  ",0.6721836429604611,0.4391154653454071,0.025049973
106,Ink Fairy,@CDranias,1584865198.0,1241659689970077696,"Maybe the aussies should call it the US virus  Quote Tweet9News Australia@9NewsAUS · Mar 20, 2020The US is the country of origin for most of the cases in Australia, the prime minister has revealed. #COVID19 #9News
https://9news.com.au/national/coronavirus-most-cases-in-australia-from-usa-scott-morrison/5b04121e-a597-4aaf-a1a7-04be02f9d376?ocid=Social-9News… ",0.9979421544769942,0.6047524302123788,0.22281034
50,Jarrod Thweatt ≥,@AhsokaAshlaTano,1584865266.0,1241659689970077696,  ,1.7657473994997902e-130,0.01813247552960133,0.010068049
117,John Reads Tweets ,@ChubberGuard,1584865376.0,1241659689970077696,"As it popped up in several countries, the wartime media suppressed the information. This includes countries like Britain, USA and Germany. But Spain was freely speaking of it. To the world, it seemed like Spain was especially hard hit or that it was the source. 2/2  ",0.3041314679370177,0.3618509848261742,0.10428757
